essay_id	essay_set	essay	rater1_domain1	rater2_domain1	domain1_score
6580	3	In "Rough Road Ahead: Do Not Exceed Posted Limit" by Joe Kurmaskie, the terrain has a negative effect on the author. He claims that "I had been hitting my water bottles pretty regularly, and I was traveling through the high deserts of California in June" (Kurmaskie). This shows that he has been drinking his water too fast due to the heat from being in the desert at summertime. After travelling from a long time with no water he lets out a chuckles thinking of how he shouldn't have taken the old mens advise. He explains that "It was a sad, hopeless laugh, mind you, but atleast I still had the energy to feel sorry for myself." This is an example of how badly the terrain had effected him. Its gotten to him so much that he applauds himself for having the energy to feel sorry for himself.	2	2	2
6581	3	The features of the setting affect the cyclist because the cyclist is tired and thirsty already. The features include a desert like setting of California, it is extremely hot, there are no signs of civilization in sight, and the roads are like hills that always were throughout the desert. On top of those facts the cyclist is dehydrating because his water suposely has diminished. 	1	1	1
6582	3	"The setting of the short cut affected the cyclist in many ways. For example, he said there was rusty water, and ""it tasted like battery acid"" because of this he was not able to drink it which made him become dehydrated. Also in the story is says, ""flat roads were replaced by short rolling hills."" This could of made the journey even harder for the cyclist because now he had a little more effort to get up the hills one more example is towards the end he says ""i began breaking my ride down into distances, i could see the horizon telling myself i could make it there."" By the cyclist saying this it seems like he has given up and he realizes that this journey is going to never end untill he dies. That is how the setting on the story affected the cyclist."	2	2	2
6583	3	Some features of the setting affected the cyclist. The rolling hills, poisonous snake, and the conditions of the road worried her. For example, @CAPS1 said, "I was going to die and the birds would pick me clean, leaving only some expensive outdoor gear and the diary." @CAPS1 had high doubt when saying that quote. @CAPS1 didn't think @CAPS1 would ever make it. Finally, @CAPS1 reached another destination and again finding herself asking another older man for directions!	2	2	2
6584	3	In "Do Not Exceed Posted Speed Limit" by @PERSON1, the features of the setting greatly affect the cyclist. The first major example is when the cyclist finds that the flat road is turning into "short, rolling hills," These hills are increasing the difficulty and are causing him doubt that he will make it. An additional part of the setting which caused major doubt was that he was in a deserted desert. "There was no one in sight, not a building, car, or structure of any kind." The horizon was what kept cyclist going. "I began breaking the ride down into distarres: I could see on the horizon, telling myself that if I could make it that far, I'd be fine.' The horizon kept him hopeful and determined. Without the setting he would not have been in such a serious but luckily in the end the setting helped him be determined enough to make it.	3	2	3
6585	3	I guess really sofcty comes first, and you have to be cautious when yay out in the streets on a bicycle. I really don't understand much, so I can't write much.	0	0	0
6586	3	When the biker listened to the old folks he had confidence. He biked to the first town but it was like a "ghost town." A town is a town. soon after that, he did not see anything. No cars, buildings, or anything. He was getting sad and dehydrated. The old men swore there was a town coming up so he put his trust and confidence in him once again. He saw a building  coming up, but it was just an old wore down factory. He thought he was let down. He was sure he was going to die, right there right now. He than saw a siga for a fish comp! He was overjoyed! The place was real to! He thought of them as his savior! The settings effect the cyclist tremendously.	1	2	2
6587	3	In the story "Rough Road Ahead Do Not Exceed Posted Limit" by Joe Kurmaskie there were many settings that affect the cyclist. One example would be when he came up to a water pump and he tried to get water out but water didn't come out. "…working the handle of the rusted water pump with all my strength. A tar like substance oozed out…." (Kurmaskie). Another example is when he came across rolling hills, and the scaring heat, he also came across a snake that took up most of the pavement.	1	1	1
6588	3	The feautures of the settings affect the cyclist if it is just between buildings and cars the cyclist won't be able to break free and bicycle freely. So it can affect him.	0	0	0
6589	3	The setting in the story was hot. The biker was sweating a lot. The whole town was empty. He pasted empty buildings. Their were rivers and big hills that he had to ride through. As it says about the buildings, "somehow, I climbed away from the abandoned factory of juices and dreams, slowly gaining elevation while losing hope." The setting would affect the cyclist because their was no one in the town. Also, their was high hills.	1	1	1
6590	3	The feature of the setting greatly affected the cyclist. He was a California desert in the month of June. There was no water in the desert so he had to use the water he had. He says the sun began taking harder ran and the terrain turned into short rolling hills. The hills made him work harder which dehydrate him guccher.and since there was no water in the desert, he could have died of dehydration	2	2	2
6591	3	When your with your family in ocean city biking down the board walk your only obstacle is people. When your in a race on whinedy roads you could have lots of obstacles. The wheather could be your greatest obstacle. You could pass out by lack of water and scorcing heat. You could fall over by slippery roads from the rain. Along with that nature could lay its toll apon you. "a ridiculously large snake…blocked the majority of the pavement in front of @NUM1, Kurmaskie) @CAPS1 like a snake you don't know what you could come across.	1	1	1
6592	3	Many of the features of the setting affect the cyclist. The cyclist is biking through deserts. "A rediculously large snake" this quote shows that only is weather and climate agasint him but also nature." I could drop from heat stroke" another great quote showing how hot it really is where the cyclist is." There was no one in sight, not a building, car, or structure of any kind." A great detailed desciption of where the cyclist is and how deserted the area is." The bottle only contained a few  tantilising sips." This cyclist is low on water in the desert and in the desert with no water that could be a very bad thing. The above quotes really draw you in and you get to see the many features of the setting and what its like for the cyclist.	3	2	3
6593	3	The features of the setting in Rough Road Ahead: Do Not Exceed Posted Speed Limit." Affect the cyclist in many ways. First in the essay when the @CAPS1 says he is in the deserts of California, that can affect because it gives them an idea of how hot it most likely was out there and how lack of water can really harm someone. Also when the @CAPS1 describes the water pumps and what comes out o them, it can give the cyclist a feeling of disgust and remind them to always keep a good water supply.	2	2	2
6594	3	"Many things in the setting of the essay ""Do Not Exceed Posted Speed Limit" affected the cyclist throughout his journey. One very important part that affected the cyclist greatly is the fact that he was in a deserts without a good supply of water. Another part of the setting that challenged the cyclist was the length of his journey. Those two factors of his journey to Yosemite combined are probably the worst and most challenging things that affected the cyclist."	1	1	1
6595	3	The features of the setting affected the cyclist because. It was a lack of the water and he was in the high deserts or California .For example in the text stated "when I tried a drop or two, it  had the flovor of battery acid. That showed clearly when he tried to get water from a pump what it clearly came out as the settling was extremely hot and made the cyclist misreable in such ways.	1	1	1
6596	3	In the story the features of setting affect the cyclist because there is not much he can depend on. For example, it is the desert and usually there is nothing there. The cyclist only has a limited supply of what he needs and riding through there does not help him. For example, the old men who gave him directions made him think he could make it longer before he could elgo. This affected him because throughout his journey his lack of water slowed him down and made him think he wasn`t going to make it. When he finally got to "Gary & Wilber's fish camp," he learned a lesson because when an old man asked if he know the quickest route to Yosemite he said yes, I have a very good map.''	2	2	2
6597	3	In many real-life situations, nature or a setting can be the biggest hindrance in succeeding, or even surviving. For example, the cyclist with stood the blozing heat of the sun as he pedaled through what seemed to be the @CAPS1's living room: Dry, desolate, and extremely scornful. "Wide rings of dried sweat circled my shirt, and the growing realization that I could drop from a heat stroke on a gorgeous day in June." @CAPS2 and depicts the intense heats of the desert. Another feature in the setting was the every hanging hills and steps though pedaling down the hills was an easier task, traveling up the hill, as well  as maneuvering the thirsts and bends served as a direct conflict. An example, "with what I believed was my last burst of energy I maneuvered a setting affect a situation is ultimately, the cyclist reached his destination is great relief. But the biggest hindrance was along his setting.                        	3	3	3
6598	3	The features of the setting affected the cyclist because they made the simplist challenges for him. The back of water and the snake in his path are examples.	1	1	1
6599	3	"First, by accepting the old mens' advice, the cyclist was setting himself up for some hardships that he would, easily have avoided by using his map. He first encounters a "ghost town", lifeless and most importantly, waterless. Then, he encounters a pump that gives out water tasting like "battery acid". Next he rides past a "Rough Road Ahead" sign; not the most encouraging thing on his journey. To add to the despair, he has to manever his way past a tempting yet empty juice factory. Finally, the parched cyclist arrives at "Gary and Wilber's Fish Camp. "To him, this simple bait shop was like  beacon of hope from food himself."	2	3	3
6600	3	In this story, the cyclist was trying to make it to Yosemite, California. In the begining, the cyclist was sure of himself he decided to ask some old men that looked like they haven't been off their porch since Carter was in office for directions. The old men ended up leading him into the middle of the desert. In the desert, the sun was beating down on him and he had a limited supply of water. There was no sign of civilization what so ever. These hot conditions made the cyclist very hot, tired, and very thirsty. But that didn't stop him, he kept going and eventually he came apon a little town where he could drink cool water and take a well needed rest. 	2	3	3
6601	3	Through most the story, the features of the setting affect the cyclist in a more negative way. For instance, he makes it to this town a guy swore was there, but it turned out to be abandoned. So he let out a sad, hopeless laugh and still had energy to feel sorry for himself. Another feature was the Grape Juice Factory, also abandoned, so he hung his head and that blues tune "summer time" rattled in his brain. A third feature was his thirst. So he stuck some pepples in his mouth to take his mind off it. Then he thought about how lucky he'd be if he checked, @CAPS1 negative to me.	2	2	2
6602	3	The features from the essay affect the cyclist in many was because he is getting field, and is drinking more and more water. The raods are getting rough so he needs to slow down. If he slows down he will get tierd and need more water although he is all out on top of that the old men really didnt know what they were talking about the features affect the cyclist.	1	1	1
6603	3	The setting affected the cyclist in many ways, for example, the heat was unberable beating down on him during this long ride. The fact that he had no where around him to fill up his water bottle. So he was deing of thirst and he didn't know where he was going or how far he had to go. The setting was crushal in this story.	1	1	1
6604	3	The setting in the begining of the story is flat an easy but as the path becomes unfamiliar it turns into many hills & turns. This effects the cyclist a lot because he was low on water & was begining to become dehydrated.	2	2	2
6605	3	The setting affects the cyclist. He starts to see things that will affect his mind. Passing there is rolling around him he starts to feel abandoned and misled because there are no signs is going to right way.	1	1	1
6606	3	The cyclist has to over come a lot of obstacles. For example, there is a snake in his path, so he cationly rides around it. Also, there are alot of hills and he wasn't sure if he could make it up those hills. Furthermore, he is almost out of water so he could die of heatstroke or dehidration. In conclusion he over comes these obsticles and achieves his goal. 	2	1	2
6607	3	In the essay "Rough Road Ahead" the author goes through many seneries. All of the places that the author goes to make him even more determined because he wants to find water and he just wants to get to Yosemite. The determination pushes him to keep going further and further. And then the determination finally pays off after he goes around a turn because he then see's a place where he can get something to drink and a place to cool down.	2	1	2
6608	3	The features of this setting effect the author while he is cycling. They changed his hope to doubt. There were no buildings or cars, which led him to believe he would never get to Yosemite. Also, it had a rough terrain that made him doubt that he would ever get water. Im sure if the setting had buildings, people, even just civilization, then the cyclist would of been fine.	1	2	2
6609	3	Blazing tempitures, lack of water, dwinding hope-all are the parts of the setting that affect the cyclist. Blazing tempitures, because the hotter the water was the more perspiration and lack of hydration was appointment you can't put anything back in your skin and your body can't function without water finally dwinding . Hope, the cyclist didn't think he was going to live through this. He tried hard and pushed himself and success was made. He lived.	2	2	2
6610	3	The features of the setting affect the cyclist because he get tiring. The character, in the story is ridding his bike for a long period of time and he gets tired. He rides alone with nothing or none around his accept the tries and wild animals.	1	1	1
6611	3	The features of the cyclist is rough because of the hills, snakes, heat, amount of water. The hills give you a breeze going down but going up give you a hard time. The snakes can hurt you by bitting. The heat could make you sick. The amount of water can really hurt you by being dehydrated.	1	1	1
6612	3	The features of the setting affect the cyclist in several ways. The features of the setting affect the cyclist through the posted speed. Due to how the setting is the cyclist have a rough hill with wish.	1	1	1
6613	3	The hills and bumpy road slow him down, and he is dehydrated. That is also slowing him down because he needs water. There are obsticles in the road too, such as, the big snake laying across the middle of the road. He is lost without water and could possibly die of an heatstroke.	1	1	1
6614	3	Knew what he was getting himself into so if he needed water or nething like that, it was probly his own falt he should have brought some with him.	1	1	1
6615	3	The cyclist and his journey in Rough Road Ahead: Do Not Exceed Posted Speed limit were impacted by the setting. The "deserts of California in June" caused him to be weary very easily. The terrain change from the flat road to hills made him feel less confident because he felt the road sign was taunting him by saying DO NOT Exceed 55 mph. He could only go @NUM1. Finally, the large snake created an obstacle for him by blocking the majority of pavement in front of the cyclist. All of these features affected the cyclist in some way.	3	2	3
6616	3	The story is basically talking about more people with cars should ride bicycles to work or to school's so it want be alot of polution in the air.	0	0	0
6617	3	The features of the setting affect the cyclist in many ways. The temperature in the area affect the way he drinks his water which leads him to thinking he is going to die because he is running out of water. The "towns" he comes to are so deserted he thinks he is going in the wrong direction. All the settings in the story also help him not to give up but keep on going. In conclusion even though he had to go through all that doubt he was going to be alive in the end he still went on and tried. In the end he did make it and all it was worth it.	2	2	2
6618	3	There are many setting that affect the cyclist. One feature would be the terrain around him. Also, the obstacles faced by the cyclist. Another feature would be the types of wild animals & scarceness of water around . Also, the old man who gave him unimportant & non-updated information. All of these would affect the cyclist because it would  wear & fear on his physical & mental strengths.	2	1	2
6619	3	I think that there were many things contributing to the cyclists state at the end of the story. First, there was the fact of time. He was cycling in June which is very hot due to it is summer. Second, he was cycling through California which is warm even in early @DATE1. And third he was traveling through the deserts. So if you put all of that together. He was cycling on a hot June day in the deserts of California. These @NUM1 things all contributed to the characters state. He went through dead towns in his search for water and found an old well pump with extremely hot water, that tasted like battery acid. He drank to much water at the begining which left him with just spit toward the end. He was lucky to find a fish camp in the middle of nowhere and to have found water. The three things made him drink too much water at first and barely left him with enough.	3	2	3
6620	3	The features affects the setting of the cyclist because in some ways they through you off a little with others lines and then will get confused of what their acually talking about. The littlest thing that could through you off is the line when it says before the last world war. That kind off through me off alittle.	1	1	1
6621	3	"The setting that were affecting the cyclist was the lack of water he had because it says "the water bottles contained only a few tantalizing sips,"" and the text also says "" I'ld read once that sucking on stones helps take your mind off thirst by allowing the spit to circulate" he wouldn't be trying to get his mind off of thirst if he wasn't thirsty."	1	1	1
6622	3	The features of the setting affect the cyclist because it was June and the cyclist had little water. The cyclist was dehydrated and couldn't find any building or water for many miles. The cyclist took advice from oldtimers which didn't know what they were talking about. In conclusion, the weather and the location affected the cyclist.	1	1	1
6623	3	The cyclist pedaled through all types of different terrain. Through   hills, high desert, flat roads and the woods. This cyclist took the advice of bunch old men who thought they knew a short cut to the Yosemite national park. This short cut turned out to be a nightmare. The cyclist had only brought so many water bottles and was quickly drinking them all. The setting of this story changed a lot making the cyclist at   times have to pedal faster and slowes. The cyclist was quickly worn out and started to loose hope in himself. The  terrain kept changing making it  hard for him not to be thirsty. Eventually he drank all of his water and knew he would die of dehydration or a heat stroke. As he came up over a long hill he saw a bait store and stopped inside to have a drink vowed not to listen to a bunch of old guys again.	2	2	2
6624	3	"The features of the setting make him happy because he meets some people that tell him of a route that will take a lot of time off his trip. This is what the text says, "what I shouldn't have done was let them have a peck at my map. Like a foolish youth, the next morning I followed their advice and launched out at first light along a "shortcut" that was to slice away hours from my ride."" He also talks about not talking directions from old timers. This is when the text says,""	1	1	1
6625	3	During the cyclist journey to Yosemite many things got in his way and slowed him down. For example, he listened to the old men who gave him wrong directions to where he wanted to go. Also, his water supply was getting low which drained his energy alot quicker than usual. The heat also played a part of his energy loss. The heat made him sweat perfusely which made the water that was in his body be of no use.    	2	1	2
6626	3	The features of the setting affect the cyclist in many ways.For example, he was in the california desert in June.The heat and lack of water can cause people to become dehydrated,passout or even die.There are not many sources of water in the deserts.The terrain didn't help him much either, hills use a lot of energy and  made him perspore,causing him to lose flood from his body. The cyclist was greatly affected by the features of the setting.	2	2	2
6627	3	The rider in the story "Rough Road Ahead" by Joe Kurmaskie has a very analyzing mind, which is affected by things around him. At first, the rider "rode into the morning...with a smile" because of the bright sun, and the "cool pines" and rushing rivers"...he is very confident with the old mens directions, this first sign of disapointment is when he comes to the "ramshackle shed..." And the "...sight of this was troubling..." to him, but he rode on. He thinks as he rides over the "crippling hills" that maybe this wasn't such a great idea. Finally he comes to a old bait shop, and the "modern bathroom" that he enters to drink from, gives him relief from the desert he had just been riding through.	2	2	2
6628	3	The features of the setting affected the cyclist a great deal. The landscape was hard to ride on, there was intense heat & little water. As a result, it was a long trip and he had a difficult time reaching his destination.	1	1	1
6629	3	At first the trip was easy going and flat. It was a nice day out and the water sapply was draining. Soon, the path became hills and soon got rough. Even though the pines gave shade it wasn't enough to help the cyclist. Eventually he reached some what civilization after enduring a grueling climb and by cycle trip through the woods.	1	1	1
6630	3	"The essay on ""Rough Road Ahead"" is about the dangers of speed and assault. It's just letting you know to follow instructions and read signs. You should always keep close @NUM1/= out for signs and things.  "	1	1	1
6631	3	Setting that affected the cyclist was water tempeter, rolling hills and condition of the roads. Water was a factor because he need cool water to keep him hydrated he came to a shed with pumps after running out of water. He started pumping the water it was hot but he took it he tried to let it cool down but it didn't. Rolling hills was another a tender to the cyclist hardships because the road started off flat then ended up in hills going up his can strain the leg and makes it harder to keep riding. Another hardship was road condition, it was smooth at frist then it became rough and rocky. Those was some affects the cyclist had to over come	2	2	2
6632	3	Setting  depends on how you can go or move. The town hills helped the cyclist. The up hills didn't. The cyclist  got a bad idea or aditude when he saw the towns he was upset and mad he didn't want to die and yet he though. He was going two. He said he wouldn't trust old men anymore. They didn't know where were talking about .How and why did he trust even in the first place.	2	2	2
6633	3	"The features of the setting affect the cyclist in many ways.For example, ""I noticed the terrain changing. Flat road was replaced by short, rolling hills."" This quote shows that his surroundings were giving him diffuculty and a challenge for his travel. By describing the hills as ""rolling"" it helps the reader imagine the obstacles he was going through. Also, the sign that read, ""Rough Road Ahead; Do Not Exceed Posted Speed Limit."" gives the reader a feeling that the character is in danger. Lastly an example of the setting that helps shows the charcters hardships is, ""no one in sight, not a building, car or structure of any hand."" If anything were to the happen to the character, as the author was foreshadowing, he'd be stranded and all alone to die. He'd be in trouble and there would be no one to help him. If the author did not use these examples, the reader would not easily get a picture of the troubles he had to overcome. In conclusion these examples added emphasise and meaning to the text.   "	3	3	3
