essay_id	essay_set	essay	rater1_domain1	rater2_domain1	domain1_score
6719	3	The features of a setting can affect the cyclist in many ways. For example, while he was riding in the hot sun he became very thirsty because whe only had a few drops of water left. That is how the setting can affect the cyclist.	1	1	1
6720	3	The features of the setting affect the cyclist greatly. They make it hard to concentrate, because its heat, they make it unbearable. The setting has the affect of drowsiness and thirst, "Dry bitter lnad, longing, longing.	1	1	1
6721	3	In many ways, the setting affected his journey to Yosemite. If the setting wouldn't have been so bad, the long ride wouldnt have been as hard on his body. Since the setting was a very hot day in June, in a California desert, when he did find a well he said, " followed by brackish water feeling somewhere in the neighborhood of two hundred degrees. " @CAPS1 thing about the setting is, if it wouldnt have been so hot, he wouldnt have needed as much water. And, if he would have gotten the water he needed because it was so hot, it wouldn't have been so physically draining on his body. I know it was physically draining because he said "  I  could drop from a heatstroke on a gorgeous day in June. " In conclusion, the setting played a major role in the story.	2	1	2
6722	3	In the story "Rough Road Ahead: Do Not Exceed Posted Speed Limit" The man was riding a bike through rough lands. His adventure wouldn't of been an adventure if he was just riding his bike an flat smooth element. The fact that the hills were steep, rocky and many hills is what made his bike ride what it was.	1	1	1
6723	3	The features of the setting affect the cyclist is the old timers advice of how to get some were. Than the town they told go to was a ghost town. After he keep going the place that they told him to get water was very old and rusty and he pumped it he gaid tar came out. Than as he made his way in the dessert there way a snake came in the road he go around it. So never take advice from old timers.   	1	1	1
6724	3	In the story, "Do not exceed posted speed limit," the features of the setting affect the cyclist by showing the rough conditions he went through, and somehow perservered through. The author states numerous times the lack of water, and the rolling hills. Followed by brackish water feeling somewhere in the neighborhood of two hundred degrees." This shows the struggle he went through and supports the setting story and how it affected his trip. This also shows how he perserverd through his struggles and made an effort to finish.	1	1	1
6725	3	The riders condition was rough, from flat land to rolling hills. This would be hard for some one who is dehydrating. There was a snake in his path so he went around it. This would be dangerous he could blackout from lack of water and then get bit by the snake.	1	1	1
6726	3	The cyclist depicted in the essay is greatly effected by his surroundings. First, he described a beating sun and pines and rushing rivers. All these items are very animated things. The river is even described as rushing instead of, maybe violent. The setting is active just like the cyclist. Next, a ramshackle shed is acknowledged, as well as rusty pumps and a bad souding corral. When these old, forsaken things one mentioned, it can be noticed that the cyclist starts being a little in despair. And to tap that off, he drinks water that tastes like "battery acid." Battery eats at skin just like the setting is eating at the cyclist.	3	2	3
6727	3	In the essay "Rough Road Ahead" the setting is able to affect the cyclists emotions and moods in both positive and negative ways. As the author travels through the desert he is already upset because it is so hot and water is scarce showing how the terrain is a negative influence. Another example would be when the author first sees the old water pump and he is relieved showing positive influence but the pump oozes a shine like substance he referrs to as tasting like "battery acid" changing his mood for the worst. Finally, the pebbles he puts in his math show is desperation and willingness to try anything to survive show a new posotive outlook on the desert until a pump "lodges are in his thro at" making yet another negative influence. All of these feature lead him on his way to "Gary and will fish camp" and grounded an extra boost on his journey through the desert.	3	3	3
6728	3	"The features of the setting affect him because it is hot and their is no where to go. An example from the test is when they said ""There was no one in sight, not a building, car, or structure of any kind."" There was also a part where he got to a sign that said ROUGH ROAD AHEAD: DO NOT EXCEED POSTED SPEED LIMIT.The speed limit was 55 mph. He was doing a water a water - depleting 12 mph. Sometimes life can feel so cruel. Thats what affected the cyclist the heart the hilly roads, no water, snakes, rough roads, and most all no directions."	2	1	2
6729	3	The features of the setting affected the cyclist because where they were.It was like in te middle of nowhere and every person they asked are having all times.They go the wrong directions to the nearest town.The old guy told him it was @NUM1 miles down the road when he went @NUM2 miles to the next town and said to him self he will never take directions from a gut that has all timers and hasn't left the confines of their porches since carter was in office.	1	1	1
6730	3	When the cyclist is in the "serenity of an early sunset evening", the man enjoyed his cycling just hoping he could cut his time in half. Then, once he got the advice and headed down the road he saw a ghost town which is never good. Next he came to the fork and the town he came to had no water. On the way to the new town he came to the bumpy road and going @NUM1 he was out of water but finally after his determination he made it to a place that was very nice. So as you can tell the features of the scenery road affected him greatly.	2	2	2
6731	3	I think that the setting made him find more courage inside him self to save his water and go to the next town with out any water.	1	1	1
6732	3	The environment affected the cyclist violently in the story "do not exceed posted speed limit" It seems that all of the harsh conditions of cycling in California all worn down this kid who took some faulty directions from older people at one stop. The heat and lack of water supply made the boy dehydrated. It says in the essay "The water bottles contained only a few tantalizing sips. Wide rings of dried sweat circled my shirt, and the growing realization that I could drop from heat stroke on a georgus day in June simply because I listend to some gentlemen." this explains on how simply exhausted he had become due to the miles of cycling, and the beating down sun and total lack of water due to absence of all towns. He came to the point of almost dying from heat exhausgen because of the faulty directions of the old people. Next time, he better make sure to keep extra water and stick to the map for directions.	2	2	2
6733	3	"As the cyclist makes his journey towards Yosemite, the setting causes him much worry and concern. In the beginning, the narrator is content and excited. He is doing something that be lovers, is heading for a beautiful destination, and has found a short cut to save him hours of time. He is confidentin the directions given to him by the old men. However, as he continues down the winding road, his environment makes him doubt theirjudgement. The first town he comes to is entirely deserted.Though at first he laughs it off, he laster realizes just how much trouble he in if he didn't come to a civilization soon. The cyclist runs across ""ramshackle shed[s]"" and shut down factories, and as his water supply sinks lower, the road seems to tantalize him. He passes a water pump (just what he needs), yet the water is something close to toxic. A road sign reminds him not go too fast, though he @MONTH1 die if he doesn't pick up the pace. He is forced to look at a picture ofa happy boy guzzling grape juice as he dehydrates. All there features of the setting, in addition to the overpowering heat and sun, drive the narrator to the breaking point.      "	3	3	3
6734	3	The feature of setting affects the cyclist because every thing that was happing years ago are happen now in todays world meaning wars. Rights & etc todays feature is the same. Every thing is repeating it's self.	0	0	0
6735	3	When riding a bike it @MONTH1 not seem to hard. For a cyclist every thing becomes more serious. The determination to win and be the best even if it kills you. In this essay he under estimates the dder cyclist. When really they are the people with more knowledge. Some of the things that @MONTH1 be hard for cyclist are the rough roads. Not only having a chance to be killed of dehydration or being ran over. Riding bike is really hard work when having to ride in hundred degree weather. Drinking drink after drink never having any water. No water and it being so hot could cause a heat stroke. As road get worse chances get higher tumble weeds and snakes in the way, he was determined to win. After all was said and he faced the horror that nature brought him he knew he was wrong wrong for them and the intelligants.	2	3	3
6736	3	The features of the setting affect the cyclist in many different ways. The fact that he was in the California desert and the heat affected him because he had limited water and was using his energy riding the bike. The "towns" he came across also made an impact on him because of the fact that he couldn't get more water or a place to rest. "I was doing a water depleating @NUM1 sometimes life can feel so cruel". This shows how the hilly terrain and dehydration and heat are affecting the cyclist.	2	2	2
6737	3	Two of the biggest setting in this story is the desert and rolling hills. This would effect the rider becaus of the dehydration that he would experience. Being in the desert would make it obviously hot so you sweat alot and the hills would make it tough on your body because you put extrat strain to get up them. So all together this would be a hard bike ride.	1	1	1
6738	3	In the story, "Do Not Exceed Posted Speed Limit," by Joe Kurmaskie, the cyclist experiences dehydration on his journey. The cyclist takes directions from older guys who look like they haven't left their porches in ages. He takes their advice and he then sukkers in the long run because he cannot find water and it is a hot @DATE1. He hikes uphills in the heating sun and fears a heat stroke. There was no sight, not a building, car.	1	1	1
6739	3	"The setting will either effect the cyclist in a good way or a bad way. In the story "Rough Road Ahead" by Joe Kurmaskie it affects the cyclist in a bad way and a good way. In the story, it continues to talk about lack of water. "When I tried a drop or two it had the flavor of battery @NUM1). This shows that the heat made the water warm, so it did not cool him down. But a good way it affect them is pebbles. ""I read once that sucking on stones helps take your mind off thirst by allowing what spit you have left to @NUM2). This shows that even though he has no water the pebbles can make him less thirsty. This is how the setting affects the cyclist. In good way and a bad way."	1	1	1
6740	3	In this story it is clear how difficult the cyclists journey is. He has to conquer wrong directions, lack of water, rattle snakes and fear of dieng. However he shows great determination and control. An example of his determination is "The old guys had sworn the next town was only eighteen miles down the road. I could make that. "This shows his determination that he feels he can go on such a long journey. An example of his self-control is shown in paragraphs @NUM1 and @NUM2. When finding this building to be abandoned, and all things, juice, anyone use would have become frustrated and wanted to give up. But not this cyclist he controlled his anger and again showed determination. And it paid off in the end he found his water and survived. This story is a great story that shows determination and self control.	2	3	3
6741	3	Early in the morning, the cyclist is eager and ready to face the adventurous path that had been mapped out by the older travelers. He hardly noticed the "sun was beginning to beat down." He was calm and was looking forward to the "cool pines and rushing rivers of Yosemite." Never once did he imagine what he had gotten himself into. As he began to approach the desert, he noticed he was running low on water. The strenuous activity of biking combine d with the scorching heat of the desert began to take effect. The cyclist was so desperate for water that he had to put pebbles into his mouth. He had once read, "that sucking on stones helps take your mind off thirst by allowing what spit you have left to circulate." The cyclist was hoping for a way out of the misery he had come across. Dehydration took it's toll, and he felt hallucinations. He was beginning to lose hope. The heat and the hills and the lack of water had the greatest affect on the cyclist. Had he not been riding through a hilly desert one afternoon in June, he would have been fine.	3	2	3
6742	3	In  the   cyclist   story  the  setting   took  a  huge  roll on  how  the  story    thined   out.The  water  had  a lot  of  effects  on  the  cyclist.The  setting  of the story  took  place  in  the  high  deserts of  california   in  june.As  soon  as  you  read   that  you  now  something  is  wrong.In   the  story  he say  ,the  sun  was  beginning    to  beat  down .This  is going  to  affect  him because  hes  riding  through the desert on  a  bike,which  causes  him  to  become  dehydrated .I  eased  past,trying  to  keep my  balance  in  my dehydrated  state.Thes begining   to  lose  his  mind  because  he  has  no water  because   of  the  setting.Everything  about  the setting  causes  the  cyclist  some  problems.The  heat ,the   setting ,the  lack  of  water  almost  causes him his  life.    	2	1	2
6743	3	The setting affects the cyclist in alot of ways. The first way is that he was riding in the middle of a desert in June. If he was riding  in @LOCATION1, it woudn't be painfully hot. Also, the rolling hills probablly didnt help If it was mostly down hill, he would have been fine. Riding a bike up a hill when your tired is near impossible.	1	1	1
6744	3	In the story "Do not exceed posted speed limit" by Joe Kurmaskie the features of the path to @ORGANIZATION2 greatlly affected the cyclist. One the way to the park the cyclist came across a big snake that covered the road which greatly frightened the biker. Also the roads were long and very bumpy and windy. The road weren't the most comfortable to be riding on. In the story "Do not exceed posted speed limit" by Joe Kurmaskie the features of the path to Yosemite National Park greatlly affected the cyclist. One the way to the park the cyclist came across a big snake that covered the road which greatly frightened the biker. Also the roads were long and very bumpy and windy. The road weren't the most comfortable to be riding on. There was nothing insight for the cyclist to see. The cyclist did not have much energy because he had no hope for him. The author states, "…  gaining elevation while loosing hope." Last the weather was hot and dry which tired the cyclist out. He had no water with him and with the weather he had no energy or hope to help him through the journey to Yosemite National Park.	2	2	2
6745	3	In the story "Do Not Exceed Posted Speed limit the cyclist expirenced a few life threating times during his adventure. The first feature was when was in a deseret with temptures of @NUM1 degrees and his lit bit of water tasted like battery acid. As he tried to keep going he lost hope and thought he was going to die. This affected him because as he lost hope he thought more negative about things and didn't think he would make it but the he got the agility to move on. In this story the setting affects the characters dramatically.	2	2	2
6746	3	The feature of the setting is making the cyclist frustrated, thirsty, and confused. The features are making him frustrated by he thought he was going the right way where he really was going out.	1	1	1
6747	3	The features of the setting affect the cyclist because the features are what cause the climax of the story. An example of this would be the line, "I had been hitting my water bottles pretty regularly, and I was traveling through the high deserts of California." This line shows that the author was in a very hot place, being in a desert, but also that he has a low water supply. These two conditions are what cause the climax, which is the possibility that he could collapse at minute from heat exaustion. This is why the features of the setting affect the cyclist.  	2	2	2
6748	3	Certin features of the setting affected the cyclist. In the essay by Joe Kurmaskie, he desribes he's experiences when he cycled through the desert. ''...arrived at the first town''...it fit the traditional difinition of a ghost town. ''at first the cyclist was amused at this town and maybe a little scketle at it because the old "codgers"  told it to be thriving. Halfway through his journey the stated ''sometimes life can be so cruel." Water was running low and he still had a ways to go untill he made it to the park and he felt as If it would never end. All that he sees aroun him as hills of nothingness under the sorching son with his limited amount of water. No buildings are around the cyclist. The ghost town and the lack of shade or soluation are very features of the setting that make that cyclist feel like a fool for taking advice from older men.        	3	2	3
6749	3	I am going to explain how the setting of the cyclist affected him. The setting of the cyclist affected him by making him very hot & drinking his water & he would soon run out of water & dehydrate. For example in the story the cyclist would always bring up the little bit of water he had left & around the essay he talked about the dehydration he was seeing & even death. Another example is the relif he had when he drink the water from the sink. In conclusion, this is how the setting affected the cyclist.	2	2	2
6750	3	This paragraph tells about how careful you should be on the roads.This also talks about what you have to be aware of.There so many things that could happen.You have to take control when your on the road.	1	1	1
6751	3	The features of the setting in "Do Not Exceed Posted Speed Limit" by Joe Kurmaskie affects the cyclist in many ways. For example it states "This place might have been a thriving little spot before the last world war it fit the tradition definition of a ghost town." This statement is talking about town he arrived at when he was trying to get to Yosemite. This would affect the cyclist because he was riding in confidence in the beginning but then the first town he arrives in looks like a ghost town, which would bring his confidence a little bit lower than before. Just like when people travel when they know where they are going they feel good, but once they come to a place they know then they wont feel so confident. Another example is when he has to ride on rolling hills, and then comes across a "Rough Road Ahead: Do Not Exceed Posted Speed Limit" sign. This would affect the cyclist because then he would be frustrated and stressed out because he rode all that way and not he cant go any further, and that is not the place he wanted to be at. Therefore the features of the setting in "Do not Exceed Posted Speed Limit" by Joe Kurmaskie affects the cyclist.	2	3	3
6752	3	The conditions that the bicyclist faced that affected his trip were various amount of things that could really screw your ride up. Some of the conditions were hot It was very hot and that makes it hard to think fast, move fast and make good decisions another would be there was lose gravel and that makes it tough to maneuver and you have to watch your speed. So he's not going anywhere in a hurry. also there were lets of hills and that makes for an uncomfortable ride and a tiring one atthat. Adding to that he was fresh out of water and that can mean dehydration again bud judjment and even heat stroke or exoustion another bad thing is he was in the middle of nowhere so its not like he could stop. Some where we asks for a drink to, there was nothing around for miles. These things show how rough the rode was made because these conditions exsisted.	2	2	2
6753	3	The setting was very hot dry and was a desert. This setting effected him be it was making him very dehidarted and hot. It was very hard for him to go any fourther but he knew he had to keep going. Also the land was very barin and ething around. Clearlier the setting effected the biker.	1	1	1
6754	3	The setting affected the cyclist because they were in California in June traveling back rodes, with no place to stop for water, if the cyclist would have followed the path they intended on following the ride probably have been more enjoyable and he/she wouldn't of had to worry about a heatstroke or running out of water, they would have been fine.	1	1	1
6755	3	The features of the setting affect the cyclist greatly. There were hills and rocks, snakes and no buildings or people. The hills and rocks would make it much harder to to stay strong and be able to keep riding. The abandoned building and there being no people, could affect him emotionally. It would make him loose hope and the determination to keep going to find destination. He did not think he would get that after seeing a deserted town. After all, he did say, "It didn't really matter. I was going to die … "(Kurmaskie).	3	2	3
6756	3	The main features of the setting that affected the cyclist are the fact that it was June and the dessert heat. "… I could drop from heat stroke on a gorgeous day in June…." (kurmaskie @NUM1). This helps us realize how bad the heat is in June in the middle of California dessert. This affected the cyclist by his dehydration and the fact that he was inthe middle of no where with no one to help him. This is how the month of June and the dessert heat affected the cyclist.	1	1	1
6757	3	"The features of the setting greatly affected the cyclist in this story. First, when he got to the road sign that said "Rough Road Ahead" he was already low on water, but that made things much worse. The rough road made it harder for him to pedal; therefore, he was working harder and getting thirsty. Also, when he stopped at the old Welch's Grape Juice Factory, he noticed some pebbles on the ground and shoved them in his mouth. "I'd read once that sucking on stones helps take your mind off thirst by allowing spit you have left to circulate". Lastly, "GARY AND WILBER'S FISH CAMP", could possibly have saved the cyclist's life. He stopped there and finally got a well deserved drink of water to settle his dehydration and fear. The setting and features severly affected the cyclist throughout his journey.  "	2	2	2
6758	3	"In "Rough Road Ahead: Do Not Exceed Posted Speed Limit", the features of he setting affect how the author feels. In the beginning of the essay, the author is confident and happy, and the setting is, "a reservoir camp ground outside at Lodi, California" (Kurmaskie @NUM1). This sounds like a good place to be refreshed and to feel confident. Later into the bike ride, the author is affected negatively by the barren area he comes to when he says, "This sight was troubling"" (Kurmaskie @NUM1). Finally when he reaches a modern store, he is relieved due to the modern facility when he states, "Then, as easily as rounding a bend, my troubles, thirst, and fear were all behind me" (Kurmaskie @NUM3). The area the author goes through has an effect"	2	3	3
6759	3	The features of the setting affect the cyclist because they don't ride as much anymore and don't know the best routes to take. So they just take their old routes, thinking they are still the better way, but when they use them they realize how tiring and bad they are.	1	1	1
6760	3	""At some point, tumbleweeds crossed my path.." being out in the desert with limited or no water can make one feel like life is very cruel. The sun was beating down and no water or shade is seen when he reaches a point. The sign that said "Rough @CAPS1 ahead; Do Not Exceed Posted Speed Limit." had to be intimidating. Considering he was on a bike he could only move so fast. Those old men probably were never off their front porch since carter was in office. yes like the writer said "the world is a fluid place.  Things  change." The old men probably had close to no due what they were talking about considering things have changed since @NUM1 (when carter was in office). The snake that he came upon, must have been rather intimidating. Knowing there is a creature like that, there is bound to be more. In eseance I think the setting was a major part why the cyclist felt that way"	3	2	3
6761	3	From what there is in this  picture the cyclist is riding a dry and area which could mean that it is very hab and the cyclsit looks to be going down hill there looks to be a lot of turns. From the body position of the cyclist he seems to be trying at his best and hardest to make it to his destination. All of this could be a bag stress on the cyclist, he maybe sweating really hard and maybe tired the wind @MONTH1 not be helping him at all.	1	1	1
