essay_id	essay_set	essay	rater1_domain1	rater2_domain1	domain1_score
6634	3	Well the features of the setting affects the cyclist is a lot of ways. Well when his water was is hot to drink He got some pebbles and stuck them, in his mouth. He had heard somewhere that if you do that it will dilute your spit. The terrain of the story was very rocky and hilly. Those are the features of the terrain.	1	1	1
6635	3	The features of the setting affect the cyclist. The hills afected the cyclist because they would be harder for him to ride The abandoned town also affected him. When he got to the town he was hoping he could get more water and take a break but when he got there the town was abandoned. Also the highway was hard for him because it would be hard for him to ride on. Also there was nowhere that he could get water around him. Many features of the setting affected him.	2	2	2
6636	3	The features of the setting gradually contribute to the cyclist's anger. For example, at the beginning of the story, the cyclist comes across poisonous snakes, "one ramshacke shed, several rusty pumps, and a corral that couldn't hold in the lamest mule." All of sights trouble the narrator, and he starts to becom frightened and neurotic. As he cycles on, the narrator begins to deplete his water supply, and when he stops to restock, "the water wouldn't cool down" and "it had the flavor of battery acid. The cyclist's lack of water frustrates him, and the increasing steepness of the hills adds to his annoyance. The final straw came when the cyclist passed by what he thought "had been a Welch's Grape Juice Factory." The narrator goes on in an outrage to explain that hopes to die out on the road, in order to spare himself from the dreaded features of the setting.  	3	2	3
6637	3	The features in the setting most definetly affect the cyclist while he travels. The cyclist is incredibly thirsty and tired and the setting he's placed in just gives him no hope of survival really. He first comes to a "ghost town" where he finds no one is living. This first encounter with isolation in a desolute place doesn't really affect him because it is the first place he finds but the rest of the storys setting comes to mimic this. As he travels he is met with barren land, no water and no people in sight. It's June in California and the cyclist fears he @MONTH1 soon suffer from heat stroke if he doesn't find water yet. It doesn't help when he comes to an abandoned juice factory that taunts him with the one thing he needs to survive. All in all the features in the setting make the cyclist lose hope, make him feel like he will die if he dosen't find water.	2	3	3
6638	3	The setting in the story "Do Not Exceed Posted Speed Limit" was based in the hot, and dry terrain of California. This setting affected the character mood. It did this because some of its included feature can seem as actual metaphorically based moods. An example from the story is, "The cool pines and rushing rivers of Yosemite..." this quote from the story could suggest the tone and the mood of the scenery which would be calm, and relaxed. So from the scene that is being seen and the mood it has would also give the character its mood.	2	2	2
6639	3	The features of the setting that affect cyclist depends where they are located. In this story the feeling on "nothing and the desert around him and the heat gave him no hope". It all depends on where you are cycling. "It didn't really matter I was going to die." This quote states his feelings on what was going on through his head while he was dieing of thirst. He felt nothing he was sure he was going to die until he found a sign of civilization that was near and he became better and his hope was raised.	2	2	2
6640	3	I think the features of the setting affect the cyclist in many ways. It being a long, hot, lonely ride there, had an effect on him. It scared him which made him go longer. He had nothing to drink and thought he was going to die it made him weak. The snake in the way caused him longer and every stop that had once there effected him to.	1	1	1
6641	3	I would think even riding a bike for so long can be bad for the behind. But also good exercising especially for the legs all the strength you get from the muscle. To know where you going could take forever. But I do know what they would have to face all types of weather, but as long as you have gear on no harm could come to you.	1	1	1
6642	3	At first he was mad because he took advise from old men who never left their porch. He got scared he was going to die because had he drunk all his water and he didn't know how long it would be till he got some more. He shouldn't have drank his water so quickly knowing he had a while to go. Then he became happy when he saw the bait sign. He biked quickly down the hill.  	1	1	1
6643	3	The features of the setting affect the cyclist, in the story Do Not Exceed Posted Speed Limit, in many ways. The cyclist is affected because the setting is depressing and frightening. When the cyclist first sees the speed limit sign of 55 mph, he says, "Sometimes life can be so cruel". Because he can only go 12 mph considering he's on a bike. After seeing the sign, a snake crosses his path. He's frightened by it because it looked like a diamond back and he was trying to keep his balance and ease past it. Since the main problem the cyclist is faced with is the lack of water, the dry, long hills seem to make him more weak and tired. Tumble weeds crossed past him and there was no water in sight That is how the features of the setting affect the cyclist.	2	2	2
6644	3	The features of the setting affected the cyclist greatly. It made him become dehydrated. For example, in paragraph @NUM1 sentence @NUM2 he stated "I eased past, trying to keep my balance in my dehydrated state." This shows how the heat and climate of the setting affected him by how he was getting thrown off balance and wears     to him getting dehydrated. The setting of the story "Do not exceed posted speed limit," by Joe Kurmaskie, effects the cyclist in the story.	1	1	1
6645	3	The setting in this story greatly affects the cyclist. It is an extremely hot now in California while the narrator in aiding his ride. This causes him to become delighted much faster while he is on a "Short hit" leading to no where. "Wide signs of dried outcast winded my limb, and the growing realization that I could drop from ?? a gorgeous day in June" This gust shows how that calm day really was and the fact the cyclist is sweating so much shows how much the weather is affecting him. The rolling hills in the story also affect the cyclist. By cycling towards up and down no often, it secured his journey. It cowed him to the side even longer in getting to a town with water.The deserted knowns in the setting are negatively also affected the narrator. It gave him a hopeless narration because there was no place to stop and depleting his water supply.	2	3	3
6646	3	"Joe Kurmaskie had a rough time trying to get to Yosemite National park. First, he received directions from an old man, Joe followed these instructions; little did he know that he would be headed for many hardships. After he reached the first town he checked his supply. About @NUM1 more miles he reliced his bottle was getting low because he was travelling through the high deserts of California. It is hot cool out there,then the terrain changed. He no longer had that much water. He ran into a snake, which he swore was a alamond back. Finally, he came to another town, got some water and then left after going through ghost towns. Riding in conditions that are hot and unfamiliar are hard to do. Adding hills to heat is not a good combination, with nothing around val it can be very dangerais, even fatal. Before you bike thinkof what conditions are ahead of you"	3	2	3
6647	3	because he was telling to make it wirte he nite to go and he much it because he was drieing to soil and because he was drieing 55 mph pert hour and 12 mph and sometime life can feel so cruel in life ya dig and that ia all I can said right now.	1	1	1
6648	3	Each time the author comes to a point where the setting isn't very appealing or helpful, he loses hope for reaching his destination or finding a nice place to rest and get some fresh water. For example, the text states, "one ramshackle shed, several rusty pumps, and a corral that couldn't hold in the lamest mule greeted me. This sight was troubling" (Kurmaskie @NUM1). The author has a sort of negative, sarcastic tone at this point. This shows that he's getting frustrated and losing some hope. He also mentions that the "sight was troubling" which shows how big of an affect the features around him or scenery can have.	2	2	2
6649	3	Lots of features in the setting play an affect on cyclist. Some that @MONTH1 play an affect are the heat, flat road that's had to ride on, or how there	1	1	1
6650	3	This essay is an american tale that express how hard it is to do someing. But do it thought determination. The cycle are faced with many change not onnly physically but also menataly. There was no one in sight not a building  or anything. As this rider come to think that the sabstatal beating he took from the ride he is tirde and no sight of baidi say he might not be able to do it.	1	1	1
6651	3	The features of the setting greatly affect the cyclist. First of all he is travelling through a desert in California in June so the weather is extremely hot and the cyclist needs water, however as he is running out of the water he brought along with himself, he cannot find any other water himself so he is thirsty and almost dehydrated. Also, if frustrates him that when he finds water, not only is it hot it tastes like battery acid @CAPS1, when the cyclist decides to conserve some of his water and go to the next town to get more water, but there is another setback. The condition of the road is so poor, that the cyclist cannot go more that 12 mph. Thus, if he ever reaches the next town. he still will have to wait longer for the much needed water, travelling at 12 mph. The snake is also another setback that the cyclist was fortunately able to escape. Thus his major concern is the lack of water.	3	3	3
6652	3	The features of the setting affected the cyclist in many different ways. At first it was a bright shiny day and the cyclist was happy. He reaches the first town which is a ghost town and it makes him sad. Riding on he begins to lose water. The once bright shiny day began to beat the heat down on the cyclist. He reached a ramshackle shed and began to lose hope. He loses water quickly and becomes more dehydrated. The terrain become slopes and hills and the ride become harder, when he reached the grape drink factory his hopes were almost gone. But just over the hill was a fishing shop. He used his reining energy to speed down the hill to get water and get his energy back. 	1	1	1
6653	3	"The features of the setting, affect the cyclist in many ways. For example, when it says, "The cool pines and rushing rivers of Yosemite had my name written all over them." The features of this setting are making the cyclist determined. Another example, is when it says, ""At some point, tumbleweeds crossed my path and a ridiculously large snake – it really did look like a diamondback blocked the majority of the pavement in front of me."" The features of the setting are making him brave and couragious. The last example is when it says, "I hung my head." The features of this setting are making the cyclist have despair. That is how the features of the setting affect the cyclist."	1	1	1
6654	3	In the essay "Rough road ahead do not exceed posted speed limit," the cyclist is affect both positivly and negativly by the setting. Setting is the sounding in which the story tacks place. In the story a cyclist loses his way and band is put in to dangous because of it. The setting of the story can be dicrided as mountainous with many rolling hills. The author discride the setting by say "@CAPS1 two miles in to the next section of the ride, I noticed the terrain changing." The change in terrain made it more difical for the cyclist. However he also used the land to give him hope that he was almost their. He told him self that he'd make it if he make it over the next hill. The setting of the story gave the cyclist hope and problems in his journy to sarive.	1	1	1
6655	3	The cyclist was affected by the fact that he took advice from some old men who's information was not accurate. Then he cycled along the desert which was very hot. He had a limited supply of water and that also affected him in a very bad way. He almost had a heat stroke a few times. He was probably angry that he took these men's advice and got himself into this. Then when he found the fish camp, he was overjoyed with relief. But at the same time, if he had asked someone else for directions, he would not have been in this situation in the first place. So it's really confusing because he probably felt relived and mad at the same time. And then the other old man asked him did he know the best way there. He was right to say yes because if he didn't, the old man would have gave him some more messed up direction and he would have been out there again, about to have another heat stroke.	3	2	3
6656	3	The features of the setting affects the cyclist by rush he /she got when speeding down the hill. The fresh morning air, no limits just you and your feet. Speeding, going as fast as you can with your heart pounding in your chest. No boundarys, when you can go where you like, when you like. No people to get in the way of you and your need for speed.	0	0	0
6657	3	"In the short story Do Not Exceed Posted Speed Limit it is shown that the features of the setting do affect the cyclist through the story. In the story the cyclist is faced with the mental and physical journey he takes while riding his bike. Being unware of where he is on his journey the setting begins to really affect him. For example as he keeps making his journey he is affected by the old towns and desert places he even says that ""The sight was troubling."" As he continues to California in June the heat and the long journey really began to affect him both mentally and physically. For example he says, ""I got down my hands and knew working the hands of the rusted water pump with all my strength."" The quote shows because he is biking so long is looking water and there is not a town is sight he becomes weak and although he is at terminated to make it through this journey he is becoming more hopeless and sorry for himself because of the setting he is placed in. "	3	3	3
6658	3	"@CAPS1 directions, June, lack of water" all are elements that effect the rider on his ride. He took directions from older people who promised the rider a short cut. I turned out that their short cut was wrong. When the rider went on this trip, it was June in California. It would have been burning hot. Lastly he had drank most of his water during the trip. He could have died if he didn't find the other water source. These were some elements that effected the rider on his trip.	2	2	2
6659	3	The feature of the setting greatly affect the cyclist in "Do Not Exceed Posted Speed Limit." The features in the story changed the speaker's mood throughout his journey. For example, in the beginning he came across a deserted town so he was cautious. Next, he came across a fork in the road which was troubling to him. Then he passed a snake and had the obstacles of the hills which made him become determined. Finally, his determination changed to relief where he reached Gary and Wilber's fish camp. In conclusion, the setting in the story greatly affects the cyclist by changing his moods and attitude towards his journey.	2	2	2
6660	3	In the essay, "Rough Road Ahead: Do not exceed posted speed Limit," is about a man that follows some bad directions and in the middle of a desert is stuck without water. He starts to lack confidence in the directions when the setting changes. He said, "After fourty miles into the pedal, I arrived at the first town it fit the traditional definition of ghost town." He had been told this was a thriving town but was left with nothing. This was a big let down and the cyclist wasn't so positive this had been the right choice. He keeps on riding and finds another dissetling sight." One ramshacle shed, several rusty pumps, and a corral that wouldn't  hold in the lamest of mule greeted me." @CAPS1 was another place said to be good but all he got was battery flavored water. On the last strech of his bike met with rough rolling hills, a diamondback looking snake, and an abandoned juice factory. All of this brang his spirits lower and lower until he thought he would die. The cyclist ended up finding a store but he was discauraged by the environment he was in a hot and could have died.	1	1	1
6661	3	In the essay, the cyclist is greatly affected by the features of the setting. Under the conditions he could barely survive and make it to his destination. It is clear that the features of the setting are affecting him when he states,"The speed limit was 55 mph. I was doing a water-depleting 12 mph. Sometimes life can be so cruel." In his efforts he is slowly getting weaker and the sign he sees only makes him feel worse because it seems to him that it mocking him. He also states, "I'd read once that sucking on stones helps take your mind off thirst by allowing what spit you had left to circulate. With any luck I'd hit a bump and ledge one in my throat." This shows he is ready to give up completely and wouldn't care if he died. From the author's tone, it is clear that the features of the setting do affect the cyclist.	3	2	3
6662	3	Features of the setting such as the hot sun, no water, and "Gary and Wilber's Fish Camp," greatly affected the cyclist. Since the cyclist was traveling through the high desserts of California in June, the temperature was really high and the hot sun left "wide rings of dried sweat" on his shirt and made the cyclist realize that he could drop from a heatstroke. Also, the fact that the only water around felt "somewhere in the neighborhood of two-hundred degrees" and "had the flavor of battery acid" prevented the cyclist from drinking it and put him in a "dehydrated state." @CAPS1, "Gary and Wilber's Fish Camp" affected the cyclist by solving his problem of dehydration, since there was cold water availible for him upon arrival.	2	2	2
6663	3	The features of the setting affects the cyclist in many ways. First of all, if the cyclist didn't listen to the old man, he would have never gone through this trouble. Also being that he didn't have enough water when he went on riding, caused him to be real dehydrated. He should of turned back as soon as he ran out of water. Plus the heat made him real hot and thirsty. He should know how to never trust any strangers and try things on his own.	1	2	2
6664	3	The features of the setting effect the cyclist .The setting makes him feel thirsty, dry, hot, and lost. In the story the setting plays a big party in the cyclist's will to ride to the next town. First the cyclist asks directions from a guy that never left his house in decades this creates, doubt. Also in the story it says "Tumbleweeds cross my path" this makes the cyclists feel lost. Finally it say the "water bottles contained only a few tantalizing sips." This makes the cyclist thirsty and tired. The features definatly have an effect on the cyclists.	2	2	2
6665	3	In the story "Rough Road Ahead: Do Not Exceed Posted Speed Limit," the cyclist is affected by the setting in many different ways. He was biking in the middle of the summer in a very hot state of California. This affects him because he is sweating and he is running out of water and he could possibly become dehydrated. The roads are very hilly so, he has to use alot more energy to get up the hills. That's why I think the cyclist is extremely affected by the setting in the story "Rough Road Ahead: Do Not Exceed Posted Speed."   	2	1	2
6666	3	The cyclist had to deal with some tough terrain throughout his ride. First, he was in the "high deserts of California in June." @CAPS1 usually brings a picture to my mind of a very dry, hot place. The cyclist had trouble finding water he needed, and thought he might die of heatstroke in the conditions. Also, there were hills. The cyclist said he had to ride over "one long, crippling hill." From my experiences as a cyclist, hills are the worst part, especially if you're thirsty. The climate in this story was very hot and dry, and the terrain was full of hills, so altogether, that would make one bad bike ride.	2	2	2
6667	3	Snake, heat, hills-all are what the biker had to deal with because of certain settings. He had to deal with a diamond back. He was going through the desert so it was like @NUM1 degrees. While he was biking he had to go up crippling hills. He had a redicuious setting to have to bike with. I would never be able to do what he did.	1	1	1
6668	3	The cyclist had alot of problems with his setting. It was very hot and he started getting low on water. This caused him to become dehydrated. There was hardly any civilization so no one could come to his aid. Also, the path he decided to take was long and vigorous.	1	1	1
6669	3	In the story "Rough Road Ahead: Do Not Exceed Posted Speed Limit", written by Joe Kurmaskie, the author describes the setting as hot, tiresome, and aqusting. You get this picture from the author when the bikerider is describing his surroundings. The bikerider describes his as the high desserts of California in June, being hot and musky, ruff terrain, etc. This gives you an image of what the bike rider feels physically and emotionally. This image shows how tired, thirsty, and determined the bikerider really is. Using words, metaphors, and imagery the author puts you in the shoes of the bikerider emotionally and physically.	3	0	3
6670	3	The features of the setting affect the cyclist by the people around the area of @LOCATION1. Taking advice from older people in open landed place can affect the cyclist.	1	1	1
6671	3	In the story "Do Not Exceed Posted Speed Limit" By Joe Kurmaskie the settings affected the cyclist by how hard his ride is. When the road was smooth He ride was fast when it was the hills it took him longer to get to the next town.	1	1	1
6672	3	Varias faetures of the setting affect the journey and mooble if the cyclist in the text. The first feature of the setting that affect the cyclist is the desert. He is "traveling through the high deserts of California in June" , and this is making him really thirsty. "[He] had been hitting [his] water bottles pretty regularly "because of this. He later runs out of water, and becomes hopeless. He becomes hopelee because there is no building or establishments anywere in sight. Therefore no water and there isn't a place to get any water. Another feature of the setting that affects him is the people that gave him directions. They told him abait a shoutcut, and he listened. This through everything off, and he was left with despair. Another feature is the Gary and Wilber's fish camp.This lead him to sicocss of finding water. This affected his mood because he had hope again. In conlusio, many of the features of the setting affected his mood in many ways.	2	3	3
6673	3	The features of the setting affect the cyclist for many reasons. If the setting is dark trainy, there aren't going to be ??? running outside. If it is snowing, the ??? are not going to be swimming in the water.	0	0	0
6674	3	That explains how the features of the setting affect the cyclsit. Is because some people don't care about there features. Every body are working for a good feature but, others they @CAPS1 still from people who work. Everyday to have a new features.	0	0	0
6675	3	"In "Do not Exceed Posted Speed Limit" by Joe Kurmaskie, the setting affects the cyclist by making him doubtfull. The cyclist is doubtfull that he won't make it to Yosemite National Park. ""It didn't really matter. I was going to die and the bivas would pick me clean, leaving only some expenses outdoor gear and a diary with the last entry in praise of old men, their wisdom and their keen senses of direction." This shows how he is doubtful. Finally in the story the cyclist doesn't think that they will make it."	2	2	2
6676	3	In the passage, the features of the setting affect the cyclist because every time he comes along something different a new idea about his survival comes into his head. First, when the cyclist sees the mule he says, "This sight was troubling," he is now troubled by the fact that he had not seen a town yet and starting to doubt the old mens advise. Also, when he sees the juice factory he puts some pebbles in his mouth and says, "It didn't really matter, I was going to die and the birds would pick me clean." This shows that seeing the broken down juice factory gave him no hope and he tells his self that he will die.	2	2	2
6677	3	In the essay, "Rough Road Ahead: Do Not Exceed Posted Speed Limit," the setting had a major impact on the character. The cyclist was trying to get to Yosemite National Park, but on the way, he had some troubles, the fact that there was not much civilization affected the cyclist because he was not able to refill his water bottles, so he grew very thirsty. Also, the many hills and the fact that it is summer impacted him greatly because he became tired out more easily and could not pedal as fast. When it says, "A tar like substance oozed out Wouldn't cool down," it showed how he wasn't able to drink. Also, when he passed the grape juice factory, it must have been torture to him since he was so thirsty. If he hadn't taken the advice of the men in the first place he would have had a much shorter ride and would not have been so exhausted. The setting affected the cyclist a lot in this essay.	3	3	3
