essay_id	essay_set	essay	rater1_domain1	rater2_domain1	domain1_score
6780	3	"In the story “Do not exceed posted speed limit” by Joe Kurmaskie the setting affected the cyclist in a hard way. With only a few sips of water left he said'' … abandoned years earlieR, by the looks of it it had been a @CAPS1 Grape Juice factory and bottling plant. A sand blasted picture of a young boy pouring a refreshing glass of Juice into his mouth could still be seen. I hung my head.'' When only having a few drops of water and seeing that would have increased my thirst more. Another way the setting affected the cyclist in a hard way was "" The speed limit was 55 mph. I was doing a water-depleting 12 mph. sometime ife can feel so cruel.'' This remind him that hes not in a car, and that hes not even going half the speed limit. The setting affects the cyclist by reminding him how long his journey is, and now at this point he is suffering."	3	2	3
6781	3	In the essay, “Rough Road Ahead:Do Not Exceed Posted Speed Limit,” the setting the cyclsit is in effects him greatly. One evening when he was resting he got into a deep conversation with a couple of elders. Eventually they got to talking about his journey, and the two men gave him direction for a shortcut. “But on that morning it fit the traditional definition of a ghost town.” When he arrives at the first town, he finds it deserted, this effects the cyclist because has eventually going to need more water. As he continues, he comes to a slep in the road. “After I had arrested the first few of these a large highway sign jumped out at most read:ROUGH ROAD AHEAD:DO NOT EXCEED POSTED SPEED LIMIT” This sign was indicating that the road was going to be bumpy, which makes it even more challamging for the cyclsit. So, the setting is very important in this essay because it has a lot to do with how the cyclist feels. When the abandoned towns come into pray, no enging to feel hopeless. When the road get bumpy, he gets tired. When he gets to an actual running store, he’s relieved.	2	2	2
6782	3	The feature of the setting affects the cyclist because the features is just a brief preview of what the text is going to be about or who is involved in it. The cyclist gives you what you want and need to know so the affect would be about time the feature is finish play in noone would want to see the cyclist.	0	0	0
6783	3	"In the story, ""Rough Road Ahead: Do not Exceed Posted Speed Limit,"" by Joe kurmaskie, the features of the setting affect the cyclist. The setting of a story is the background, place, and time the story took place. In the story, a cyclist needs to get to @CAPS1 Park. He stops and gets direction from a group of old men, who aren’t up with the times, and the cyclist gets lost. He faces drought, a snake, and being lost in the desert, the cyclist says, ""At some point, tumbleweeds crossed my path and a ridiculously large snake – it really did look like a diamond back – blocked the majority of the pavement in front of me. I eased past, to"	1	2	2
6784	3	The cyclist choose the worst time to ride his it was an “early summer evening” in California. At this time the sun is hot and with little water and also lost, it was hot the best choice that he made. A cyclist before do a trip he or she should be prepared for whether conditions and also check a map of the place before going anywhere. 	1	1	1
6785	3	The cyclist run into a diamond headed snake, is out of water and is in the middle of nowhere the thing I would do is find some rope or cord time old building or tree and hang myself for taking directions from old people  that havent left their porches since carter was in office.	1	1	1
6786	3	The features of this particular setting affected the cyclist in many different ways. Upon arriving at the “ghost town” early in his journey, he felt slight amusement at the situation. But he soon became very troubled when he became aware of the several rusty pumps and a weak corral, next to a ramshackle shed. The cyclist additionally experienced a bit of irony as he approached the 55 mph speed limit sign complete with a warning to strictly obey it. On his bicycle, at a pace of 12 mph, he could not even reach the 55 mph speed if he had wanted to. Before he reached what appeared to be an abandoned welch’s Grape Juice factory, the cyclist felt this twisted amusement yet again, as he laughed. The text states, “It was a sad hopeless laugh, mind you, but at least I still had the energy to feel sorry for myself.” @CAPS1, his suffering was through when he discovered a “fish camp,” with a modern bathroom and working sinks. The cyclist’s relief was so immense that he,” had an overwhelming urge to seek out Gary and Wilber (the owners), (and) kiss them.	1	1	1
6787	3	The setting of this story takes place with a man biking and then taking advice from old timers to a faster route. The biker knew from the start that he should have not given his map. But thinking the old folks knew the route he took theyre advice. What the biker should have done was look for someone to ask and make sure the route would work. But jumping to where he wanted to go led him to dehydration and much more struggle than needed. You should always think things out before you take action, just to be safe.	2	1	2
6788	3	The features of the setting affect the cyclist because he first didn’t know where he was going and took directions from people that he wasn’t really sure about. It was hot he was running out of water he had no idea where he was there were snakes. His water was running out. there were no sings he kept thinking that he would never take directions from an old guys and that he would stick to the future.	1	1	1
6789	3	At first when he gets the directions from the old men, he thinks he will be fine. When he gets to the first town he’s tired and almost out of water, but still thinks he will be in Yosemite soon. When he gets to the water pump in the middle of the desert, he’s tired and thirsty and he realizes that the directions the old men gave him were out of date. He’s really not happy about listening to them and not following his map. When he gets to the fishing place he is greatful for the water in the sink and for the rest and when the old man offers to give directions to Yosemite he thinks he will just use his map. Throughout the story the cyclists needs change from feeling confident to feeling depressed to feeling relived.	2	3	3
6790	3	In the story ‘Do Not Exceed Posted Speed Limit, the setting seemed to affect the main character (the cyclist) very much during his pedal, for example, whole the dry desert setting made him think that he could survive with out water, he became dehydrated. The first town, with @NUM1 degree watter could not satisfy his standards. The old velches June factory, was all run down, and is no longer in business, much like the desert, just old barren unuseland. While yes the cycalist survived the pedal, the desert setting opposed a great challenge for him. 	2	2	2
6791	3	There are many features of the setting that effect the cyclist. One feature is that it is getting hotter and it will eventually effect him. The line “I wiped the sweat from my eyes to make sure it wasn’t a mirge.” shows that the heat  might be starting to effect him. Another feature is that he is in the desert and running low on water. The line “I had been hitting my water bottles pretty regularly” shows that he is drinking a lot of water and is running low. Another feature is that he is riding in the high deserts of California in June. The story says “and I was traveling through the high deserts of California in June.” Not only is it in June, but it adds heat because he is also in a desert. There is no doubt he will get dehydrated. Those are some of the many features that effect the cyclist.	2	2	2
6792	3	The setting affect the cyclist because it creates that deserted atmosphere and helps set the mood of the essay. The mood of the essay I think is a sort of dry summer day, the sort of “oh my gosh, its really hot,” type thing. The setting is a dry summer day in June, with a deserted town, tumble weeds and more to contribut to the hopeless feeling. Although he was secured, and didn’t die, it seemed like he would surely not make it judging by the lack of water, scorching hot sun, and distance, with enduring these conditions. So the setting affects the cyclist in a way that could have killed him.	2	2	2
6793	3	The features of the setting affects the cyclist because the old guys had worn the next town was only eighteen miles down the road. So the features affect reading the story “Do not exceed Posted Speed Limit” was very dangerous and unsafe for people to ride on.	1	1	1
6794	3	The setting effected the cyclist because it was bumpy and had a lot of hills which means he has to work harder. Also because of the heat he was getting dehydrated in the story after the cyclist had Been rideing a long time it says “I eased past trying to keep my balance in my dehydrated state “(kurmaskie @NUM1). The cyclist had very little water for his long trip	2	3	3
6795	3	The way the features of the setting affect the cyclist I think is disgardment. First of all, a reason would be because at the beginning of the story when the warning sign is passed, the cyclist disgards it by going down the hill anyways. Also, it states that it “rode into the morning with strong legs and a smile on my face.”	1	1	1
6796	3	The features of the setting affect the cyclist because he went through many ups and downs. At one point flowed by blackish watter feeling somewhere in the neighbor of two hundred degrees.. weather wouldn’t cool down.	1	1	1
6797	3	The features of the setting affect the cyclist because they caused him to need water. He was worn out because the setting was so intense. “Not two miles into this next section of the ride, I noticed the terrain changing. Flat road was replaced by short, rolling hills” This quote from the text shows that the cyclists terrain was changing and they affected him.	2	2	2
6798	3	The features of the surrounding landscape affect the cyclist both physically and mentally. First, the sun constantly beating down on the cyclist causes his or her body to sweat more, which makes one’s body use more energy. The sun rays also add to the heat the cyclist feels. Also, the rough road forces the cyclist to pedal very hard, which drains him or her of even more energy. For example, when the cyclist in “Do Not Exceed Posted Speed Limit” reached the rough roads, he had to pedal harder, which made him sweat more, and caused his amount of energy to decrease. Finally, the lack of civilization can make a cyclist feel hopeless, which is how the cyclist in the essay felt when he had no water or could see no nearby town. This can affect the cyclist’s will to keep pedaling, and if they have no determination, the cyclist will not go anywhere. The features of the setting can physically exhaust and mentally strain the cyclist, which makes it harder for him or her to keep going	3	2	3
6799	3	Snake, heat, hills-all are what the biker had to deal with because of certain settings. He had to deal with a diamond back. He was going through the desert so it was like @NUM1 degrees. While he was biking he had to go up crippling hills. He had a redicuiou	3	2	3
6800	3	"The setting acts as a catylist in this story. It is the aspect of the story that is always challenging the character untill the very end. In the story it says “Flat road was replaced by short, rolling hills."" This is showing that the terrain is opposing him. Also in the story it says “The speed limit was 55. I was doing a water depleted 12 mph. Sometimes life can be so cool.” This is not only showing how much the elements are owning him it also shows how is risle he is, and how satiricle life can be. The ultimate @CAPS1 in this story is when he stumbels across the welches grape juice factory and there was a piture of a boy ""pouring a refreshing glass of juice in his mouth.” No matter where the cycalist goes he is alway trying to overcome the elements."	2	3	3
6801	3	The features of the setting affect the cyclist in many ways. For example the lack of water begins to take a toll of how fast he can get to the next town. Another example would be the terrain only slows him down more.	1	1	1
6802	3	The features of the setting affect the cyclist by making him use up the last of his water because it’s hot, and than theres no one around because he's out in the deserts of California. “I wiped the sweat from my eyes to make sure it wasn’t a mirage…” (@NUM1.). This exert from the test supports my previous statement about how it’s hot because the speaker tells us how he’s sweating and that he might be seeing a mirage. “There was no one insight not a building, car, or any structure of any kind” (@NUM2.). This shows that there is no one around to help him if he falls down from a heat stroke or anything like that. So the setting is affecting the cyclists endurance.	2	2	2
6803	3	The features of the setting affect the cyclist by making it more difficult to ride. “Flat road was replaced by short, rolling hills.” “I could drop from heatstroke on a gorgeous day in June.” “a large highway sign jumped out atm.” “Rough Road Ahead: Do Not Exceed Posted Speed limit.” “sometimes life can feel so cruel.” The fact the it was such a hot day made the ride seem longer. When out of water you feel exostied. You will do just about anything to try to with stand the heat.	2	1	2
6804	3	Author Joe Kurmaskie learns the dangers of a lifeless wilderness during his experience described in “do not exceed posted speed limit.” As a cyclist riding in one of the most undeveloped areas in California, the lack of water found in this setting proves crippling to his survival. The trails he was directed to had no towns or sources of fresh, drinkable water for days. The combination of constant exercise riding through the terrain, lack of water and recources, California summer weather and lack of civilization trained the author’s energy and caused him to suffer from dehydration. Too much exposer to these conditions could have killed him. The modern time period and year also caused the directions the author were given to be in accurate, and, thus, causing the cyclist to find him self in such a dangerous area of the country. The setting of “do not exceed posted speed limit” places the cyclist in a life threatening situation.	3	3	3
6805	3	The features of a setting could be a number of different things. It could be snowing and cold, raining and of course wet, hot and dry, breezy and humid. The features could be a busy tough or a solitere country road, there could be rough terrain or straight aways. The setting of a place puts pressure of the reality of what will happen on a cyclist. In the essay a young cyclist takes advice from some elderly man and ends up riding through hot sun and ghost towns not knowing if he would survive. The heat had him feeling as though death were coming on him and the thirst had him becoming more determined to get to the next town so he could survive. If the features of the setting had been different, say he was riding on a flat road in a busy town with a breeze and places to stop for water everywhere he would not have feared for his life. The features of the setting affect how the cyclist feels and thinks. He can feel angry, happy, sad or scared and he can start to think about his own death. These have been what I believe some of the effects settings have on cyclist.	2	3	3
6806	3	The features of the setting affect the cyclist in many ways. For example when the author says “flat roads were replace by short rolling hills”, that made the author have to ride safer. Also, when he says,” the ridiculously large snake blocked the majority of the pavement.” The author had to slow down on his bike and find a safe way around it so he could get past. Finally when the author says “no one in sight”, no building, car, or structure”, he is affected because he can’t ask questions since hes lost and hes thirsty. The setting makes it hard for the author to maneuver and get to where he wants to go.	1	2	2
6807	3	The features of the setting affect the cyclist because the person who rode the  bike was very tired his legs and body needed a rest after riding on his bike for @NUM1 miles into the pedal. Also it effected the cyclist because of all the riding he had to do struggleing to get where he was trying to get but he was a strong man and he was willing to finish his forty miles of pedaling. He was also restless but he did it.	1	1	1
6808	3	The features of the setting affect the cyclist in, “Rough Road Ahead: Do Not Exceed Posted Speed Limit,” because it goes to many different terrains. The cyclist starts at a town and his working his way to Yosemite when he decides to listen to a group of old men. He started out strong until he got to the first town, which was totally abandoned. He kept going to another abandoned town. He decided to keep going until he saw a sign. The terrain was a lot diffrent with rolling hills and tumbleweed rolling by and a snake. Through listening to the old men the cyclist almost died from the threatening heat and lack of water. The setting affected the cyclist even more seriously than he could have imagined.	1	1	1
6809	3	In the story, the setting greatly effects the attitude of the cyclist. When he starts out, it is an early summer evening, he is serene while he is talking to the old men. He starts cycling the next morning and he is thinking of Yosemite, he is relaxed and confident however, his attitude about the day changes greatly when he comes across the rumshackle old shed, rusty pumps, and a corral at the park in the road. He becomes a little worried but he is not discouraged. When the terrain changes, he is a little discouraged. Then, when he comes across the abandoned factory, he is most definately a lot discouraged. A little later he comes across @PERSON1’s Fish camp, he is very relieved and thankful to the owners. The cyclist’s attitude changed depending upon whether the setting was very beneficial to him or not.	3	3	3
6810	3	The features of the setting have a great affect on the desperate travels of the weary cyclist. The sometimes disappoint, sometimes uplifting, scenery he passes affect him physically and emotionally when he passes a portrin the road with nothing but a “ramshackle shed, several rusty pumps, and a corral…” he becomes disturbed.  The cyclist is running low on water when he becomes even more distraught at a road with a speed limit posted as 55 mph, when he was, “doing a water-deleting @NUM1.” The setting of the hot, June sun affects the cyclist and puts him in a state of dehydration. In an, “ironic twist” the cyclist is affected emotionally when he passes a @ORGANIZATION1 factory that has been abandoned. The factory features a picture of a boy pouring a glass of juice into his mouth which upsets the thirsty cyclist.	3	2	3
6811	3	The features of the setting affect the cyclist more than anything in the reading of “Rough Road Ahead: Do Not Exceed Posted speeding Limit.” In the beginining when the cyclists had just begun his cycling cause he uses a positive tone to describe the setting. For example, in paragraph four he says “the cool pines and running rivers of Yosemite had my name written all over them. “ When he says this the reader imagines someone in an ??? more excited as ??? ??? ??? ??? his destination on a dry day.  As the cyclists attitude becomes lower the reader makes the connection what ?? ?? then because of the setting. In paragraph thirteen when the cyclist says, “I wiped the swear from my eyes to make sure it wasn’t a mirage and that not to get too excited” the reader can make the connection that it is getting pretty serious for the cyclist to continue as is. Overall as the setting changes to “burning sun” and extremely hot, with a shortage of water the cyclist becomes more sarcastic and less upheat. For example when taking about the rocks in his mouth he states “with only luck I’d hit a bump and lodge one in my throat.” This shows a bad mood affected by the features of the setting.	3	3	3
6812	3	The raugher the road gets for him the more determination he has at the beginning towards the end he had the mind set that, “it didn’t matter it was going to die, “this took a toll on him and it was hard to go on. He realyed he didn’t want to die that way and so he kept on, eventually leading to civilisation.   	1	1	1
6813	3	The feature of the setting affect the biker a lot because the rough terrain is described which implies that the biker probably had a hard time half way through the story he said, “Flat road was replaced by shor, rolling hills.” He said this to describe the difficulty in this race. It also makes it seem exciting because it changes things around. It wouldn’t be exciting if they said that flat roads turned into even flatter roads, or if they didn’t show the terrain change at all.	1	1	1
6814	3	Rough Road Ahead: Do Not Exceed Posted Speed Limit.” an essay written by Joe Kurmaskie, is about a solo cyclist going on a journey to Yosemite National Park. So he listens to a group of old guys and ends up lost on rough road with no water, or relylittic supply of flat road was replaced by short rolling hills large highways lon jumped out at me. It read: ROUGH ROAD AHEAD: DO NOT EXCEED POSTED SPEED LIMIT.” The rough road made have to work harder want more water and just made things tougher more than what they already were.	2	2	2
6815	3	The settings of your environment always seem to affect your mood. Take for instance the cycler. In the beginning he had a positive attitude but once he arrived at the first town his attitude started to go down from there. He explains describes the town as maybe at one point being a thriving spot, “but on that morning it fit the traditional definition of a ghost town.” Ghost towns come across very old, run down and dull. That affected the cyclist because by it not being like the old men said he was becoming doubtful, which in turn doesn’t give you the same motivation as when he started. Then when he get to what is suppose to be water and a, “tar like substance oozed out.” That makes him nevers and mad because he isn’t sure he will make it. But his attitude changes as soon as he sees the store. The setting becomes positive and so does he. So, the setting does effect the cyclists mood and attitude.	2	2	2
6816	3	Many of the settings features affect the cyclist. One of the features of the dessert like, which is the setting, is the dry air and hot temperatures. This heat made it had for the cyclist to keep going, with despair the author says, ”I was going to die and the birds world pick me clean.” @CAPS1 feature of the setting was the desolet towns that didn’t contain any water. This lack of the water made it horrible for him to continue on. The thirst was so bad that he had to put pebbles in his mouth to sucking on stones helps take your and off thirst by allowing what spit you have left to circulates. @CAPS1 features of the setting that affected the cyclist was the abandoned Welch’s Grape factory. This  factory gave the cyclist false hope because it would have been so great to have some grape juice during his thirst stricken state. The narrator called the factory.”Ironic  twist.”	3	3	3
6817	3	The effects from the setting that has an effected on me is that while riding on the bike in hot weather with only a little bit of water to drink because I would have giving up have nothing to drink. The water had to be hot.In the text it sayed “I eased past, trying to keep my balance in my dehydrated state”, I don’t think I could have lasted long, if I was dehydrated. From the look of it I would have drop dead of heatstroke.	1	1	1
6818	3	Many features of the setting affect the cyclist. For instance, in the story, “Do Not Exceed Posted Speed Limit” the lack of water in the dry desert gave a long lasting affect on the cyclist. “Wide rings of dried sweat circled my shirt, and the growing realization that I could drop from heatstroke on a gorgeous day in June simply because I listened to some gentlemen who hadn’t been off their porch in decades, caused me to laugh.” This shows the reader how all the heat and shortage of water has made the cyclist feel very hot dehydraded and that she could pass out any second. She is also thinking beyond that by just laughing at herself and trying to conserve every bit of energy she possibly can. As a result, the affect from the setting on the cyclist is that lack of water has given her humor and courage to keep going, to get to her final destination point.	3	2	3
6819	3	The features of the setting affects the cyclist in many ways. The bumpy roads. Sand in the eyes, thirst hit him too hot and humid tempures. Maybe he got tired of pedaling had to walk. A wild dog chased him went he got in town. Had no money to buy a drink	1	1	1
6820	3	The cyclist of this story is greatly affected by the heat of his souroundings. While he riding to @CAPS1, the heat of the day began to increase. The text reads “ I had been hitting my water bootle regulary. “@CAPS2 to the heat of the day, the cyclist was down to his water consuming large patterns of it at a time. He 	1	1	1
6821	3	When the cycleist mentions how hot and dry and open the terrain is, it makes me feel like he is in the desert. I also know that it’s hot because he is swreating and dehydrated.	1	1	1
