essay_id	essay_set	essay	rater1_domain1	rater2_domain1	domain1_score
6904	3	"“Do Not Exceed Posted Speed Limit” is an inspiring and almost humorous essay it take the reader inside a journey in a cyxlist daily routine. In this story the author fights dehydration as he tries to make to a national park with shortcut directions from “old timers” the setting of this storygreatly affects the cyclist and the pitty the reader feels for him. Half way through the essay, the biker had already traveled roughly @NUM1 miles; that’s extremely crazy. The fact that he is travelling through California deserts in June is even harder to believe. The first time he mentions the setting, he states he is in a ghost town, two sentences after he states that the sun was beating down. At that point he wasn’t really bothered. Another description of his setting that probably affected his ability to peddle was when he states “flat road was replaced by short rolling hills.” He was already dehydrated and had already traveled so far, the rocky roads probably didn’t help his journey much. The setting basically made the story. If he wouldn’t have been peddling in the desert, it would have just been another trip in his life. The setting makes the reader see what cyclist really go through. "	3	3	3
6905	3	The features of the setting affect the cyclist a lot. It does because the road is not in good condition and he has to travel a long distance with the bad weather. This affects him because he might get dehydrated. In conclusion there are many things in the setting that affected the cyclist.	1	1	1
6907	3	The features of the setting affect the cyclist because if they weren’t hills and rough roads, he would of been able to get to yosemite park faster and he wouldn’t of ran out of water.	1	1	1
6908	3	The setting was the main affect on the cyclist. He said it was hot and that he was lost. The cyclist had no clue were he was going and it was hot out side. He seemed very strest and that only made it worse for him. He was thirsty from all riding and the heat so he trys to get water from a water pump. The water that was in it was horable. He called it a “substance” it had a flavor of battery acid. “If he were not lost and if it were cool outside he would have water and he would not be so upset. The setting of a hot and lost place had a huge impact on the cyclist.     	2	2	2
6909	3	In my opinion the features of the selling affect the cyclist in many ways. For example, when he was talking abut the terair changing from long strat roads to shard winday one and the speed limit changing he said.he was doing a waterdepleting @NUM1 fuier sands like he is having a hard time, or doesn'twnt to go on.	1	1	1
6910	3	Due to the features in the setting, including the hot summer weather, the cyclist not knowing the area, and the California desert the cyclist is affected. In the short story “Do not exceed posted speed limit” by Joe Kurmaskie the cyclist is travelling through the hot desert in June when he realizes hes running out of water, “I had been hitting my water bottles pretty reguarly and I was travelling through the high deserts of California in June”(Kurmaskie). This is affecting the cyclist because hes becoming hot and has a low supply of water. Also the cyclist realizes he should have never taken the direction from the old men and thinks to himself, “…The growing realization that I could drop from heat stroke on a gorgeous day in June”(Kurmaskie). This quote proves that the heat of the desert is taking a toll on him.	2	2	2
6911	3	The setting of this story affects the cyclist alot. I think the setting was supposed to be most like a run-down out of dated town which didnt help him when he was lost. The town is out of date and hot. Which bring another problem, the cyclist was dehydrating because he didnt have enough water. He would hilusinate and see things that werent there. He become very tired in the hot sun. So the setttling in this short stories effected the cyclist in many ways.	1	1	1
6912	3	The feature's of the setting affect the cyclist because the condition's he is in without any water. the cyclist would be fine if he would have had more water for his trip. He ran out of water not to for into  his journey thanks to the heat of the setting he was in. the cyclist makes this statement. I was hitting my water bottle pretty regularly and I was traveling through the high desert of California in June”. The cyclist is saying that since it is so  hot where he is he has to take regular drinks of water so he stays highdrated throughout is trip. It is also saying that in the mountians with less air and how hot it is he is not doing as well as he thought he would on the trip.	1	2	2
6913	3	The cyclist had a hard trail to bike in order to get to @LOCATION1. It is easy to bike if you are on flat smoot terrain, when you get to rolling hills, it makes it a lot tougher. The biker said “I noticed the terrain changing. Flat road was replaced by short, rolling hills. It was also very hot. he was sweating and getting dehydrated, “I’d read once that sucking on stones helps take your mind of thirst.” he had eighteen miles to next town without much water. The first deserted town didn’t have any drinkable water. It was very hard to bike in these conditions, and is important to always be prepared and know were you are going.	2	2	2
6914	3	The cyclist has to endure ruff treain and bad road condisions and a lack of water is the ??? near did not help the prodlem. Ther was a good prasority he could have heat strock then his hope was stll up by a abonded welches take factry.	1	1	1
6915	3	In Joe Kurmaskie’s “Do Not Exceed Posted Speed @CAPS1” the imagery is what sets the cyclist back. The scorching dessert and plant life gives him a sense of seclusion and scares him. Because the cyclist is in the  dessert he keeps on worrying about his water and heatstroke where as if he where in a rain forest he wouldn’t worry about water or heat. I think he siked himself out just by taking in his sorroundings. If the cyclist would have pictured water all around him and arctic like temperatures I think he wouldn’t have been so worried. What’s interesting about this story is that if he would have gotten himself prepared mentally for the conditions he wouldn’t have struggled so much at the end. “At some point tumbleweeds crossed my path and a ridiculously large snake- it really did look like a diamond back blocking the majority the pavement in front of me.”(Kurmaskie @NUM1). If the cyclist word of concentrated more on the task at hand and less on what was going on around him I think he would of succeeded without as much stress.  	2	3	3
6916	3	The features  of the setting affect the cyclist in that it made him use up his water supply and tested his determination. “ Sometimes life can be so cruel” implies that he was having a horrible time coping with the setting he was in. To himself he thought be was gonna die at any moment.	1	1	1
6917	3	In the essay “Rough road ahead: do not exeed posted speed limit,” the author is continually depressed, by the features of the landscape he passes. At first he passes a ghost town, but because he has enough water, this sight doesn’t bothe him. But the next thing he sees is a rundown old shed and a “rusted water pump,” and this troubles him because he is running out of water. Then he sees a huge snake which does not help his mood, because the snake is blocking his path then he passes an abandoned Welch’s Grape Juice factory and despairs that he will never find water. The setting its features serve to dissappoint depress the cyclist in his quest to find water.	3	2	3
6918	3	"In the story “Rough Road ahead; Do Not Exceed Posted Speed Limit” a cyclist is faced with many problems. It’s really hot out, practically a desert and its in June. Just knowing that makes me want some water. Also this cyclist is running short of water and still hasn’t got to the place he needs to be. The roads are hills and bumpy which make it harder for him. Those are the problems this cyclist is faced with."	1	1	1
6919	3	At First the narrator in Do not Exceed  Posted Speed limit was energetic enthusiastic  about their journey to Yosemite national Park .After getting some helpful advice about a few short cuts the cyclist sets out for adventure .First thing they encounter is ghost town .The gentlemen they a taken advice from had assured them it was booming prosperous town .This set the first wave of doubt through the cyclist mind .Then lack of water began .They were travelling through the high desserts of California in June and slowly running out of water .Flat road was soon replaced by short , rolling hills which only increased the cyclist state deliriousness .After a few more dissapointments the cyclist decides there is no hope and they are going to die .The reader is partly drawn in believing that this is the end for the cyclist .All of the disappointments set the stage for the end of the cyclist and you can’t stop reading because you have to find out what happens.If it weren’t for the hopelessness of the setting you wouldn’t care.	3	2	3
6920	3	"When the cyclist is going on his trip, he is riding through as desert. All he sees the entire journey is a flat rode and dirt. He is riding on the road; hopelssly hoping for some form of lif. “There was no one in sight, not a building, car, or structure of any kind. “The author is trying to be positive but it’s hard, because all this scenery is doing is bringing his hopes down. How would you like it if you were riding a bike and had no water in the middle of a desert. Now, if the setting had been a nice, green forest, he wouldn’t be that worried, there’s water and shade. He has none of that in the desert. This whole journey was all mental. He always kept in his mind that everything would be ok. That is what helped him survive. This is an ispiring story, to anyone who needs a push to stey optionistic."	2	2	2
6921	3	Poor directions heat, and lack of water affect the cyclist in the story. At the beginning of the story, the cyclist is confident in the directions which would, “slice away hours from my ride to Yosemite National Park.”  As the story progresses, the cyclist is no longer so confident. The “heat of the California, June day causes him to be fluent in drinking water.” I had been hitting my water bottle pretty regularly, and I was travelling through the high deserts of California in June.” This lack of water is a big problem for the cyclist, so big that he was near heat stroke. “I eased past, trying to keep my balance in my dehydrated state. The water bottles contained only a few tantalizing sips.” He braved the elements and forced himself on, with hopes that any source of water would reveal itself to him. His perseverance paid off. “Then , as easily as rounding a bend, my troubles, thirst, and fear were all behind me. The cyclist had found a barst shop and recteved water.	3	3	3
6922	3	The features of the setting affect the cyclist. I say this because the setting is in the hot deserts of @LOCATION1. The cyclist is sweaty and tired and has almost no water left. This lack of water makes the cyclist desperate for food and water. The setting has a lot to do with how the cyclist reacts to what happens.  	1	1	1
6923	3	The features of the setting affected the cyclist in many ways. First, because there was no one in sight he couldn’t ask for any help or direction. Also, because of all the road conditions it was hard to ride a bike through all the rocky roads and he was very tired and dehydrated so that didn’t help him it just tired him more. Another reason is because of the poisonous snakes if he disturbed them they could harm him. Also, if he would had fallen off his bike a snake could have biten him and then he wouldn’t be able to make it anywhere because of the bite. Those are the features of the setting that affected the cyclist.	3	3	3
6924	3	"The features of the setting in the story affect the cyclist both physically and mentally. It affects him physically because of the rolling hills he has to trudge over and the lack of water he has. The rolling hills make him tired and weak along with the rough terrain. The lack of water doesn’t help any when he’s thirsty because of the hills. The features affect him mentally because the farther he goes the more dalerious he gets. Each more mile he keeps telling himself, if I can just get there I’ll be fine. He also blames himself for listening to the old men. And with this also came doubt. He was doubting that he could make it alive. In the story it says, “it didn’t really matter: I was going to die and the birds would pick me clean"". mentally he couldn’t make it."	2	2	2
6925	3	When the rider was riding his bike in such day settings has started to need water he was running out, So his whole adventure was to find water. Being thirsty was very hard because it made him not want to keep going because he was so tired. It made him harder on him. But it also got him more strength and because in himself, and keep on pushing. 	1	1	1
6926	3	”Do not Exceed the posted speed limit” tells a story of learning and determination, as one cyclist bikes through the deserts of California,  encountering obstacles such as snakes and a lack of water along the way.  The descriptive features of the setting greatly affect the protagonist along his journey. The essay takes place in the early summer. As the cyclist prepares to retire for the day, he takes particular note of “the serenity of an early summer evening,” and ends the day feeling calm. The next morning he is excited and rejuvenated, ready to bike again. The heat rises as the day goes on, and by mid-day the cyclist begins to worry about his water supply. He boldly continues forth reaching new terrain, rolling hills. Here he begins to lose hope, and is disappointed when he seem the “town” he hoped to find is an abandoned juice factory. The cyclist thinks he is going to die due to the heat and lack of hydration, but gathers his strength to turn the final bend, and reaches a bait shop where he can stop and get water, he is finally relieved. In conclusion, as the cyclist continues his journey through the California desert, the change in both weather one terrain coincide and affect the cyclist’s change in physical and mental strength to continue traveling.	3	3	3
6927	3	"The features of the setting affects the cyclist in many ways. For example, the story said,""I gathered up a few pebbles and stock them in my mouth"" This quote explains that the setting was very and had pebbles. The setting benefiting him by taking the thrist off his mind. If their wasn't any pebbles by the cyclist he @MONTH1 not have made it. In cocnlusion in the story Do Not Exceed Posted Speed Limit the cyclist was benefited by the features of the setting."	1	1	1
6928	3	The features of the setting affect. Any cyclist   because with the cyclist passed many time in the bicycle had problem on his/her back  when he/she will be older. When they will be a older person and they had passed many time in the bicycle, they will had a serious problems and also they will can not walk  more.	0	0	0
6929	3	"The setting in the essay “Rough Road ahead; Do not Exceed the speed limit” affected the narrator in many ways. The first thing that affected his ride was the heat. at first he didnt really notice but then it began to slow him down. Then the ways of the roads began to affect his ride, the roads went from flat sheet to short, rolling hills.” The road change and the heat made him say “I could drop from heatstroke.” Then because of the old towns he went through he was unable to get water. The water pumps were so old and unused for so long that the water was of very poor quality."	2	2	2
6930	3	The complex features of the setting affect the cyclist negatively throughout this story. His trip goes from bad to worse as he progresses to Yosemite. After taking directions from the “old codgers,” the author attempts the shortcut, but is dissapointed. He arrives at the first town but it is completely deserted. He rubbed it off though, and kept “the cool pines and rushing rivers of Yosemite,” as his motivation. He pedaled on, but began to run out of water when he arrived at a well, he found the water to be inedible, and continued. Just as if things couldn’t get any worse his trail was getting rougher, and his water supply was low. The cyclist was becoming dehydrated, and began to lose hope. He became even more of a pessimist when “a ridiculously large snake- blocked the majority of the pavement…” He kept going, and excitedly pedaled toward a building, but found it to be abandoned. He even put rocks in his mouth to help his dehydration. When he finally found the fish camp, he was relieved. All the obstacles he prospered through were worth in the end.	2	1	2
6931	3	The journey of a solo cyclist is a lonely one. The cyclist in “Do not exceed posted speed limit” had a particulaly hard journey, as made even worse by the setting. His main opponent in the battle of staying alive was the heat. In the California deserts as a day in June. It was no surprise that the sun would be heating down particularlly harder than it would at another place anytime. Also, as the terrain became hillier, his journey became even harder. There is nothing hard about biking in a flat straight line. But constantly peadling yourself up steep hills and around winding roads is no picnic. Just like the buildings around him, the cyclist’s water deteriorated as did his state of mind as his trip which started out very joyful became increasingly more mardid. “It didn’t really matter, I was going to die and the birds would pick me clean. This cyclist was fighting against strong forces of nature.	2	3	3
6932	3	"In the short story, ""Rough Road Ahead: Do Not Exceed Posted Speed Limit” by Joe Kurmaskie, the setting plays an extremely important role. The story takes place in sunny California, where the cyclist was pedaling around 12 mph. the heat made his dehydration situation much worse.  “I was going to die and the birds would pick me clean.” The cyclist was losing hope, yet he was still determined to find water. This setting was very important to the story, for if it had taken place at @LOCATION1, @LOCATION3, it would not have made sence. The setting contributes to the story by raising the intensity of the situation."	2	2	2
6933	3	"The features of the setting affect the cyclist because they started to mess with her mind. She didn’t knew where she was and on hip of that got lost. Whether you see nothing around. You or alot around you, you’re going to feel scared. They have the same affect. In the authors case, she was cycling and didn’t/couldn’t and water. This is an over whelming feeling because you can die from dehydration. She then kept cycling and saw nothing. “no one insight; not a building, car, or structure of any kind.” That is alatining no water or people around, as if you are going to be just left to die. These settings would affect anyone who came across them. They dffinately affected the cyclist because she was by herself, and on her dvun. Plus, all she had was a map, her bike and an empty water bottle."	3	2	3
6934	3	The features of this story tend to affect the cyclist very much. Because he took a shortcut he had an even longer journey than before. He was in the middle of no where with barley any water left and on top of all that he’s exhausted from all the hills on the terrien. So because he took a shortcut it ending up costing him in the long run.	1	1	1
6935	3	The features of the setting in the essay affected he cyclist because first of all he lisined to old fowks that hav’nt left their front porch in about ten years. Then he didn’t ask someone elses apirean on where to go and how to get there. His worsed mistake tough was not trusting the map he had with him the howl time. If he would have just trusted his map and not when with when the old fella said he wouldint have almost died of heat stroke.	2	1	2
6936	3	In the essay, “Do Not Exceed Posted Speed Limit” by Joe Kurmaskie, the setting affects him negatively because he was on his bicycle and he was in a hot area and no water whatsoever, like  in this quote, “I  got down on my hands and knees, working the handle of the rusted water pump with all my strength. A tar like substance ozzed out.” In the quote, the cyclist finally thinks he has found a water pump but he really gets nothing. Also, another negative thing is that he thought he was never going  to get to where he was going, but in the end , he got there and he got some water.	1	2	2
6937	3	The setting in the story affects the main character greatly because of the heat. The main charater is biking throug a desert in the summer with little water. The heat of the setting provides a problem because the main character is at risk of dehydration and heatstroke. The main character knows that if he passes out in the barren desert he will sarley die. The main character says, “The growing realization that I could drop from heatstroke.” The main character is faced with a problem of man versus nature and the heat is winning. Heat and dehydration sap the main characters energy while he is biking through a desert, desperately trying to make it to the next town. In summary, the main characters biggest problem is the heat of the setting.	2	2	2
6938	3	The setting around the cyclist affected him in one main way. “About forty miles into the pedal, I arrived at the first “town” (Kurmaskie). The cyclist put the words towns in to parentasis because it was actually a Ghost town. no on lived there, It was abandoned. Around the cyclist was deserts, and more empty towns. The father the cyclist got, the more we realized the old men were wrong as the cyclest was running low on water and there was no where to stop. He finally found some and vowed to never listen to old mens directions again.	2	2	2
6939	3	All the feature of the area have a have a big affect on the cyclist. It is a hot June morning, and he is on his bike, pedaling hard, going many miles. He can't find any water, because all the towns along the road are deserted. He is getting dehydrated, and losing strerigth. It seems like he might have collapsed it he hadn't thought he was going to @CAPS1, and if he hadn't gotten some water at that store. All in all, the setting seems to have the intention of king him.	2	2	2
6940	3	The features of the setting in “Rough Road:Do Not Exceed the Posted Speed Limit”by Joe kurmaskie affects the cyclist in a very negative way.It begins slowly with the “ghost town”.The narrorator “chuckled, checked my water supply and moved on,” he wasn’t especially worried,but the fact he checked his water suggests that he’ll need to ration it for a while.The decline continues when he reaches the fock and the “ramshackle shed.”@CAPS1 the description of the place shows you he did not like it,and he confirms that with the words,“this sight was troubling.”He wouldn’t be replenishing his water here.Any more of this he’d be dead,either from dehydration or from pessimism.Eventually he reached the road sign which declared that going over 55 mph was a bad idea.This is ironics,he only going 12 mph to put it in his own words,“sometimes life can be so cruel.”He quite obviously hates the setting,and it’s all the fault of the setting.	3	2	3
6941	3	The features of the setting affected the cyclist because he had limited water, he had to peddle harder to get up over the hills and he was getting dehydrated from the heat. For example, he had limited water because he had taken the directions from the old men and probably didn’t bring as much as he would have if he would have taken a longer way. Furthermore, to get up the rolling hills he had to peddle faster and harder. That affected him because he would have been more exhausted from peddling. Moreover, it was a June day and in June the days are hot with the lack of a good amount of water the cyclist would have started to get dehydrated. This is how the setting affected the cyclist	2	2	2
6942	3	The features of the setting affect the cyclist in many ways. For one, his body heat raised a good bit. They don’t come out and say it, but they do say, ”The sun was beginning to beat down.” We all know that it your out side when it’s hot, you get hot too. It also probably added to his dehydryeon. As a long distance running, I know what the sun will do to you during a hot day. That is how the setting affect the cyclist.	1	2	2
6943	3	The features of the setting affect the cyclist in a major way. For one, if the desert was not a deserted mountainous area, in California then the cyclist would not have the same problems. By changing anyone features of the setting you would change how the cyclist would behave in the setting. Thus changing the entire plot of the story. If the cyclist was say in the entry or a mere develop area then he would not face the same dangers as if he were in a mountainous region. The settings features have a huge affect on the cyclist.	1	1	1
