essay_id	essay_set	essay	rater1_domain1	rater2_domain1	domain1_score
6822	3	"At first the cyclist feels fine, he gets a little bit discouraged, but basically he’s fine. “The cool pines and rushing rivers of Yosemite had my name written all over them” (@CAPS1). He feels relaxed, because he is at home with the water and the pine trees. They give him a sense of comfort. He thinks that after the first ""tree"" not being that much of anything, the others will be better. He knows that he has it in him to make it, but he doesn’t know yet that he will have to travel a long way to get water. When he sees the sign, “It read: ROUGH ROAD AHEAD: DO NOT EXCEED POSTED SPEED LIMIT.” he knows that things are going to get rough, because “the speed limit was 55 mph. I was doing a water-depleting 12 mph”. At that point he starts to get worried, because he is out there more alone, and he realizes that he doesn’t have water. As he runs out of water, the landscape, and his surroundings, start to get drier and drier. He states, “tumble weeds crossed my path.” The landscape seems to get more threatening too, “a ridiculously large shake.” The landscape changes with the state of water."	3	3	3
6823	3	The setting affects the cyclist because the heat and no humanity makes him so crazy. If he was in a place like @LOCATION2. It would be just the heat because there are people every were in @LOCATION2 @LOCATION2. If he was in @LOCATION1 it would be the severe temperature drop and no humanity and he would probably die.	1	1	1
6824	3	"the features of setting that the cyclist run into does affect him. For example when the setting changes from abandoned town to an empty deserted rond that no been on in thirty years; gives a cyclist less motivation him self to go on and even less strength."	1	1	1
6825	3	Joe Kurmaskie’s “Rough Road ahead: Do Not Exceed Posted Speed Limit” tells how a cyclist takes directions from older men who don’t tell him correctly the way to get to Yosemite, so the cyclist ends up lost with hardly any water. Features of the setting such as the terrain and the sun affect the cyclist in the story. The sun was very hot on a summers day and without water makes it even difficult to keep moving because he was so hot and thirsty. @PERSON2, “The sun was beginning to beat down… I was traveling through the high deserts of California in June” (Kurmaskie @NUM1). The terrain was also bumpy and rough to travel on. The sun and the terrain can affect the cyclist very much when out on a hot day in the summer.	3	1	3
6826	3	The features of the setting taunt the cyclist with cruel irony. As the cyclist continues down his path he pasts through a ghost town, then twenty mile up the road he sees a ramshackle shed & some rusty water pumps. He attempts to get water out because he was runing out but all he could get was muck, then what he described as “water feeling two-hundred degrees, it had the flavor of battery acid. Further down the road was a sign that said rough road ahead, adhere to the posted speed limit of 55, he was going 12 mph. Even worse he found an abandoned juice factory on the way, at that point he was out of water.	2	2	2
6827	3	Do not Exceed posted speed limit, never accept travel advice from a collection of old timers who haven’t left the confinses of their porches sin Carter was in the office twenty miles up the road, I came to a fork as sorrs. I got down on my hands and kness, working the handle of the rasted water pump with all my strength. The water bottles contained only a few totalt and sips. He could or been sad person. And he could just be a bum.	2	1	2
6828	3	The features of the setting could affect this cyclist. In this case it do effect the cyclist. According to the text “Sometimes life can feel so cruel.” This is a good example because he knew that this road was going to be rough and he was only going 12 mph. So the features of the setting did effect the cyclist. 	1	1	1
6829	3	"The features of the setting affected the cyclist very much in this. The hot weather made him have a dry mouth leading to the lack of water. He used stones in his mouth and he said, “I’d read once that sucking of stones helps take your mind off thirst by allowing what spit you have left to circulate."" He used that to help him survive the ordeal."	1	1	1
6830	3	"The features affected the cyclist in many ways, one being the highway sign, ""ROUGH ROAD AHEAD: DO NOT EXCEED POSTED SPEED LIMIT."" The terrain was now short, rolling hills, which would make it harder on the cyclist to pedal up the hills, for it would take a lot more effort and energy. Also, there were roadblocks, “at some point, tumbleweeds blocked my path and a ridiculously large snake “These roadblock would danger the biker, for he’d have to manever around them, losing time and energy, resulting in drinking more water. No water is a great danger for it was June, a hot day and he is risking getting dehydrated. There was also nobody around, so if he desperatly needed water he couldn’t"	2	2	2
6831	3	After reading “Do not Exceed Posted Limit” I have seen how the scene of an area can effect your mood and attitude around things. In this story, the main character is a cyclist who takes the advice of a few old men sitting in a poseh who tell him a bad shortcut. As he is riding, he comes across some hills. Those hills really affected him physically he gets tired from peddling up and down continually. “that mood” was replaced by short, moving hills.” The cyclist could not er nuertecy tried everything, not showing how long he have to continue going up and down. There at one point he says, “@CAPS1 can feel so cruel.” There, he is upset because a road sign come up through acid tough roads, and told him not to exceed 55 miles per hour when he was fully going 12 miles per hour. This can be viewed as metaphorical also. When you take a short cut in life, there are always consciences as you decide to drop out of high school is go on how with your journal, where is always the posibility of is not working, and where you cry with no diploma ?? and he gets a job	3	3	3
6832	3	In the short story, Do Not exceed Posted Speed Limit” the setting effects the cyclist in the story. For example, the dry hot air begins to  slowly dehidrate him, causing the cyclist to lose all sense of reason, the heat also played tricks on his mind. Also, the rolling hills exhausted him from working to cycle up them. This, also with the heat factor, caused him to use up his much needed water supply. The setting in this story deeply effects the cyclist. 	2	2	2
6833	3	Features from the setting affect the cyclist in many ways. The area in he was in had a major affect. He was in cali. which is a big dessert. In the middle of some it is very hot. Bike riding on roads in the dessert with no trees or shade of any sort is quet harsh. And to be riding around where there is not much civilazation as to where you can’t get water is a major issue.	1	1	1
6834	3	The features of the setting affect the cyclist, because there is poisonous snake out thre. Your the only person ridin dow those hills all by your self. The guy had said that the next town was @NUM1 miles from where he was at. The lack of water that there were not any streams or rivers around there just in a desert with nothing.	1	1	1
6835	3	The setting is mid summer in California in the desert. It is hot, humid and very dry. There is a lack of water in his bag. He is on a trip, going down the lost, rough and rigorous roads.	1	1	1
6836	3	The features of the setting affected the cyclist because it was a hot June day in a desert in California. For example, your in the desert cycling for many hours very hot and only have limited water. This affects the author because you have to conserve the water that you have to be able to make it to the park. Anothe example, is that you are going up and down rolling hills and you legs get very tired so they don’t want to move any more. And the best example is the sun is beating down on you and your sweating so much and @MONTH1 be seeing thing but all you want to do is see something that has water. These are all things that affected the cyclist very much.	2	2	2
6837	3	The cyclist in the story is running into a lot of problems in this story. For example, the cyclist is out in the summer heat in California riding a bike. After several minutes of this, you will become thirsty. The cyclist brought water but after constant sweating the water supply has nearly ran out. Not having enough water can cause a person to become deyhdrated which then can cause them to pass-out and possibly die. So as you can see, the cyclist is affected by the setting in the story. He has been affected negatively by the heat and by the lack of water.	1	1	1
6838	3	There are many ways that the features of the setting affect the cyclist. For example the cyclist was in a very hot and dry place. Meaning there was no water any where to be seen in miles. Also towns were nowhere to be seen for it would be hard to substain life out there. This quote supports there weren’t many towns, ''About forty miles into the pedal I arrived at the first town.''This shows there aren't many towns in these parts, @CAPS1 so hot and thirsty as the text claims, ''I read once that sucking on stones helps take your mind off thirst ''this clearly shows the  man wa very thirsty. Also shows the man was very thirsty. Also @CAPS1 so hot out there the man could see visions as the text states, ''As the looks ofter had been a grape juice factory and bottling plant.'' why would there be a grape juice factory in the middle of no where. Therefore these statements above show how settings can affect ones mind and physical conditions to the cyclist.	2	2	2
6839	3	The setting that affect the cyclist is the condition of the road because the road turns all different ways and the road goes up hill so it makes it harder to go up the road the cyclist has @NUM1 miles befor he gets to a town he could run out of water. If he run out of water befor he gets there, he might have to make stops so he doesn’t make hisself sick. When he gets to the town he can get more water.	1	1	1
6840	3	"The features of the setting affected the cyclist by making him hot and thristy most of his way. As he rode he started to get tired slowly and he got work and more thirsty. He drank his water at first with out thinking to much or it, but as he went on he slowly found himselfs trying to conseve it. By the time he got to the second wild town the will he was so thirsty and tired thathe thought it might of been a ""death"" So he wiped the sweat from his eyes."" to make sure it wasn't a mirage. The only time people see mirages is when the are hot,tired, and about to kill for some water. This is what the cyclist was like after his long jouney to Yosemite National Park with the directions given by old men."	2	1	2
6841	3	The features of the setting include “There are no one in sights, not a building, car, or structure of any kind which describes the trail the cyclist was taking. These features of the setting describe how the cyclist is affected because it elaborates on his doubting whetther he will survive or not.	1	1	1
6842	3	Many features of the setting affect the cyclist. The speed limit sign makes him feel like life is cruel. His first glimpse of the welch's Juice factory makes him feel excited. Meeting the deserted fork in the road makes him feel troubled. When he finally gets there, he feels relieved. These are all examples showing that features of the setting affected the cyclist.	1	1	1
6843	3	The many features of the setting greatly affect the cyclist & his performance. For example, the cyclist is riding through a very hot area of California. This is said at the end of paragraph @NUM1: ,“and I was traveling through the high deserts of California in June.” The high deserts of California are windy, sandy, dry, and hot. Not something that someone should be cycling on, had the setting, told of the mountianous regions of California, the wither would hot be hot, or tired because the mountians are a cool, although dry place. Had I had been cycling, I would rather have cycled in a different setting, such as mountians, than an arid desert. that way I would not have to endure the discomfort a cyclist expearenced.	1	1	1
6844	3	The features setting in the story “Do Not Exceed Posted Speed Limit” are very important to the cyclist. In this story, the setting really affected the cyclist because it was in California which is a really hot place during the summer. The cyclist had problems because of the weather and on the shortness of water. Since there was a shortness of water he had to conserve it which slowed him down because he couldn’t ride as much. Although there was a cool wind and a river from Yosemite he had to pass quickly down the hill so he had even more problems. This is why the settings of the story really affected the cyclist and how much he could ride.	1	1	1
6845	3	"In the story “Do Not Exceed Posted Speed Limit” by Joe Kurmaskie the feature of the setting, affect the cyclist in many ways. In the story, it taliks about how the man is pedling twenty miles here and fourty miles there and it's very hot outside and he only has so much water abd he doesn't think he'll make it to where he was to go because its do not that he need more water. As the narrator sas"" I was travelling throuhg the high deserts of california in June"" which is extremely not in california in June. The deserts hot weather made him eimited on water supply, and the fact that he was in the middle of nowhere, no buildings around makes him lose all hope for making it through. There were snakes in the desert which endagered him, and the bumpy road made it harder for him to hold on and get to somewhere. "" I began breaking the ride into distance i could see on te horizon, telling mself if i could make it treat i'd be fine."" This quote shows his struggle because of the area he was in but also his persitance. The features of the setting affect the cyclist in this essay."	3	2	3
6846	3	Many features of the cyclist’s surroundings effect his speed and confidence. He was the only one on the road. There were no other cars, bikes, motor cycles, or even buildings. It’s like he’s on the countryside. So that makes him want to go faster, because he won’t hit any thing. The fact that he’s alone in the wide, open spaces boosts up his energy level and makes him feel more confident.	1	1	1
6847	3	To be able to have a good bike ride, you must have a good setting. To me, a good setting would about @NUM1° outside and sunny. You can’t go bike riding in snow because there is no way that the tires will move in the snow. You can’t go in rain or hail because the roads get slippery and you could getin a accident that could injure or kill you. If it is sunny outside you be able to ride freely on dry roads with a little breeze to go through your hair and you could be refreshed. That is why I believe it is important for the setting to be just right for a bike ride.	1	1	1
6848	3	this story is set in the hot in the hot desert in June and the character is a cyclist trying to get to a National Park. the setting affects the cyclist because the hotter it is the more water you need to keep you hydrated, but the man is alone in the desert. This quote “about forty miles in the pedal I arrived as my first “town”. The place might have been a thriving little syos as one time”. This quote shows how deserted the desert is and how as he rides there is nobody around no where to re-hydrate no where to get drecionsn he was alone.	2	2	2
6849	3	In the essay, “Do Not Exceed Posted Speed Limit” by Joe Kurmaskie, the setting greatly affected the cyclist. In this story, the cyclist is heading for Yosemite National Park, thinking it wise, he accepts directions from a group of eccentric old men. He begins his journey confidently on flat terrain and with a large supply of water. The first of three promised towns had been resigned to that of a ghost town. The second offered only water that slightly resembled battery acid. The cyclist soon becomes exhausted from lack of water and having to cross the now hilly terrain. He barely makes it to the third town to realize that the juice factory was out of business. The cyclist becomes sure that he is going to die of lack of water when he stumbles across a bait store. If it hadn’t been so hot, if the “towns” along the way had offered better resources and if the terrain hadn’t been so hilly, the cyclist would have had a very enjoyable ride. All of the affore mentioned factors of the setting greatly affected the cyclist.	3	3	3
6850	3	Hot, terrain, middle of nowhere- all are features of the setting that affected the cyclist. First, the hot weather in California made the cyclist thirsty and almost dehydrated. There was no place to stop for water and if there was, the water was bad and warm. Second, the different types of terrain made the cyclist really thirsty also and tired. Lastly, the cyclist was in the middle of nowhere. He couldn’t get water to hydrate himself or to sit down and rest.	2	1	2
6851	3	The setting for the cyclist is a hard and dangerous one. He had little water, and his area had tough terrains. “I was travelling through the high deserts of California in June” (@NUM1). He is dehydrated and he still has a long way to go. I went on a bike ride that was many miles long  in @LOCATION2, and we did not have water because we could not take a break. The terrain was tough, just like the author’s terrain. The camel he was in was affecting his brain, and he just wanted to get it over with. I am just glad I don’t have to bike in that terrain.  	2	1	2
6852	3	The cyclist in “Do Not Exceed Posted Speed @CAPS1” was riding through the California dessert in June. This dry, bare setting made it impossible to find any source of water. The only time that this cyclist found water was when it @NUM1 and tasting of battery acid. There was nowhere for him to find water for miles. This lack of water and scorching heat made him travel slow and wearily. He even says that he could only go 12 mph in a 55 mph zone. By taking the advise of the old men and taking a “short cut”, the cyclist past through ghost towns with no water. This “short cut” prolonged his trip, most likely by hours If he had gone through populated area despite the fact that it is a longer path, there would have been more water to drink, which would allow him to go faster. The dry, hot setting of the old men’s “short cut” made this cyclist’s trip last much longer than nessiarry.	3	2	3
6853	3	When the man began cycling he thought that this was going to be an easy for ride. For example in paragraph @NUM1 he says “Things began well enough. I rode into the morning with strong legs and a smile on my face.” As he got further he realized that he was in the middle of nowhere. The scenery was getting more and more empty. There was eventually nothing. The scenery was putting down his hope of ever getting out of the desert. For example: In paragraph @NUM2 it states, “a large highway sign jumped out of me. It read: Rough Road Ahead: Do Not Exceed Posted Speed Limit.” He realized this was going to be hard. He had to travel in bumpy roads and pass snakes without getting bit. The scenery created a sense of hopeless because it was abandoned. When he saw the bait shop, his spirits lifted and he was now hopeful and relieved.	3	2	3
6854	3	When the cyclist began his journey he was confident in succeeding. Throughout the story however, the cyclist endures many conflicts to his successs in his journey. The cyclist faced his first difificulty once he reached a small, abandoned town. “I had been hitting my water bottles pretty regularly, and I was traveling through the high deserts of California in June” (kurmaskie @NUM1). The cyclist realized he had not conserved his water and his “water bottles contained only a few tantalizing sips” (kurmaskie @NUM1). On top of his water problem the heat was unbelievable. He was losing hydration from all the sweat, and he was losing it quickly. The cyclist was also dealing with the difficult roads. There were many things this cyclist endured through-out his journey, but he was determined to finish his trip and was filled with satisfaction once he overcame these hardships.	2	2	2
6855	3	The features of the setting put an affect on the cyclist. The first thing would be listening to old men who seemed like they had no idea how far, long, or the condition of the roads where they were sending him. Another thing that affected him would be the road condition, where there were tumbleweeds, and a ridiculously large snake. The second thing that came into play would be the hot weather which made dehydration come into play.	2	2	2
6856	3	One main feature of the setting that affects the cyclist is the heat of the day. If you ride a bike in the heat of the day, you are going to use up a lot of water. Another factor is the limited supply of water. The final factor is the wrong directions from the aged men. Aged people aren’t always wrong but their info. Can be out of date.	1	1	1
6857	3	The features of the setting in the essay affect the cyclist because as he was riding his bike throughout California, he entered hot deserts and was almost out of water. The cyclist was in a very bad dehydrated state as he was riding his bike, looking for water or anything drinkable that would successfully get rid of his dehydration. After a little while, the cyclist found himself alone in the desert with no one in sight. An example of this would be “There was no one in sight,not a building, car, or structure of any kind. Another example to show how the cyclist was struggling and fighting against dehydration is “wise rings of dried sweat circled my shirt, and the growing realization that i could drop from heatstroke on a gorgeous day in june simply because i listened to some gentlemen who haden’t been off their porch in decades shown how the settings of this essay affected the cyclist greatly.	2	2	2
6858	3	During the authors ride to Yosemite, he doesn’t have the proper tools to go along the long stretch of desert he was to face, and by tools I mean water. The California desert is extremely hot and can be potentially dangerous depending on your situation the author was describing how the lack of water was affecting him. He described this with sentences like “Rattled around the dry honey combs of my deteriorating brain.” The author clearly cannot face the rugged heat with his immense lack of water. The author was getting neat stroke being passed by @LOCATION2  desert snakes and tumbleweeds. The author was clearly in a struggle against the @LOCATION2 desert heat.	2	3	3
6859	3	The settings and features are very important to cyclists one because water and food try might carry a waterbottle and a snack but they need to know  where they are going and if they will need to bring extra or not. In the story I just read he didn’t bring enough to last him so he got some directions but they were bad so he was in trouble. Its important that a cyclist knows where their going and whats around them so they don't get lost and have no acsess to food or water.	2	1	2
6860	3	"The features of setting effected the cyclist because he was in a desert in the month of June which was really hot and dry, there were also no trees around so there was no shade for him to relax in so the sun was also beating on his back. There was also lots of hills that took his strength to jump for example it says ""over one long, crippling hill."" There was also a big crazy twist in his way. He even saw a snake. All of these things made him really tired for example he didn't have much water and the sun was making him hot and dehydrated. There was no shade so he had to just take the sun beating down on his back. He had to jump over hills so that took alot of energy. He had to ride up one long hill so that also made him tired. All of these things happened back to back without giving him a break, so it really tired him out."	2	2	2
6861	3	In the story it explained the beauty of the night, also about the outdoors and how it is effecting his trip. The features of the setting effects the cyclist, because the setting was mild, sounded warm and calm. Also it showed how it contains to us. The setting was similar to the cyclist. That’s how the features of the setting effects the cyclist.	1	1	1
6862	3	The cyclist was in California in June, the sun was beating down on him this made the ride difficult with short water supply The man came upon several towns that were abandond which made his water supply less. The terrain was long and straight then turned into tall hills which had to be difficult to ride.	1	2	2
6863	3	How the features of the setting affects the cyclist is the condition of the roads, rolling hill, and the?? heat. The conditions of the road in the settings affect the cyclist because the roads are rough. An example firm the texted is “ I noticed that terrain changing. Flat road was replaced by short ralling hills. These condition make is hard for the cycled it gives him a challenge.  The rolling hills challange him a regret to stay on the road it is easly tricky and challenges so was The heat & sun was also played an affection on the cyclist. An Examples from the @CAPS1 is.” I chuckled, checked my water supply and moved on. The sun was beginning to heat doing but I barely not ???. the sun was not starting to get him  ?? sharply ??  It will start to get ????? when is ?? is high deserts. I conclude that these features in the setting affected the cyclist in many ways but he keep pushing himself to more on.  	3	2	3
6864	3	In the setting of Do Not Exceed Posted Speed  Limit, is riding a bike really fast on a rough road.	0	0	0
