essay_id	essay_set	essay	rater1_domain1	rater2_domain1	domain1_score
6678	3	The cyclist is beginning at what seems a fine idea and place. Then the conditions become hot, dreadful, and maybe sticky. The constant heat without any breeze was getting to the character. Mirages appeared, or so he thought. He actually thought he might die. Not quite an optimistic one is he? " It didn't really matter. I was going to die and the birds would pick me clean…" The heat must have been bad, he wasn't thinking straight and was slowly checking himself into a mental center! Although painful heat was a brilliant way to learn a lesson in cycling, and the old men "helping" with directions.	2	2	2
6679	3	As he began his journey, he had full confidence in the directions given given to him by the old men. After he came to the first town and there was no water, he rode on. After he found an "ramshackle shed" he became troubled , as he "had been "hitting" his "water bottles regularly" and was traveling through the "desert of California in June" and was running low on water. Coming to a place where he saw a building over hills, he "manuevered" his way down, only to find it long  deserted and himself close to despair. He was desparate for water he needed it soon. Finally, he came upon "@CAPS1 and Wilber's Fish Camp" and quenched his thirst, and was relieved. Then on  he wised up, and took no more directions from old men who knew little to nothing about cycling.	2	2	2
6680	3	The features of the setting in the story "DO Not Exceed Posted Speed Limit", affect the cyclist in the story, in many ways. The first of which would definetly be the lack of water the cyclist had, and the fact that there wasn't anywhere around for miles. From the text it read "There was no one in sight, not a building, car, or structure of any kind." This evidence from the text proves to the reader that the cyclist was getting worried. Another part of the setting would be the obvious element of temperature. The cyclist is our in the hot, relentless desert. "Wide rings of dried sweat circled my shirt, and the growing realization that I could drop from heatstroke on a gorgeous day in June." The author here, by using the elements of nature, is trying to make the reader concerned/scared for the main character. The final key had to travel and the road conditions. Although the desert is flat, he began to notice some hills in the road, and such a long distance, including the heat, could be deadly. The setting's elements, greatly effect the cyclist in this story.	2	3	3
6681	3	The cyclit of "Do not exceed posted speed limit", was greatly affected by the setting of his bike ride, which caused him pain and displeasure. He travels in the high deserts of California in June, which he exaggerates that water there was "@NUM1 degers". The great heat caused him to drink lots of water, depleting it much quicker than he would've wished. It also sopped the energy out of him, further complicating his ride. Along the way there is literally nothing there and he has nowhea  to replenish his water supply. The hilly, rough terrain also calls for hard, tough peddling, sopping even more energy. The heat, terrain, and lack of places to stop combined for an awful ride for the cyclist of this story.	2	2	2
6682	3	"The lone biker in "Rough Road Ahead: Do not exceed posted speed limit" by @PERSON1 is strongly affected by the features of the landscape. The sun is the most important factor; it drives him to first consume his water quickly, and then drives him search for a water source."The sun was beginning to beat down, but I barely noticed it...I had been hitting my water bottles pretty regularly," in this quote, it reveals that even though the biker had not acknowledged the sun, his body had required water, depleting his supply in his water bottles. A lack of water feeling two hundred degrees...it had the flavor of battery acid."" The only water that the bike is able to find is not consumable. The most important of the factors, in the matter of survival, is the fish camp that the biker finally reaches. "I stumbled into a rather modern bathroom and drank deeply from the sink." The biker had been on the brink of dehydration and the fish camp is where he finally reganed the strength to continue on his journey."	3	3	3
6683	3	Dry, thirsty, tedious-all are features of setting that affect the cyclist. First, everything is dry. The cyclist isnt any where near a town that could help him. He has been pedaling in the heat, outside for a long time. Secondly, He is very thirsty. The way he is travelling is a good sign he is in need of water. He went fourty miles before he reached the first town to stop at. He also is on a bike, So that doesn't leave him much room to carry water along. Lastly, the trip is tedious. He has been going for forty miles, and the speed limit is 55. He hasn't acceded 12 mph. All to gether, the cyclists trip seems to be adventure that takes a lot of heart.	1	1	1
6684	3	the setting affects the cyclist very strongly in the story because mentally and physically he wasn't ready for where he was going. For example the text states "No a better, piece of advice for the solo cyclist would be never. Accept traver advice from a collection of old timers who wasn't left the cosines of theer poiches since calter was in office." So a youg guy took maid advice from older guys about how to get to a pack backin thier day it probably was a shortcut.   	1	1	1
6685	3	The setting affected the cyclist because it was very hot and he didn't have any more water also, there aren't any towns that had good water in them, until he eventually arrived at this fishing comp. Due to his lack of water, he became dehydrated and really weak. "With what I believed was my last burst of energy, I maneuvered down the hill," this quote shows that he was beginning to become dehydrated and losing his energy.	1	2	2
6686	3	Different settings can effect how well your bycycle ride goes. If it is hot and you have lots of hills it makes it hard. If you have no hills and it is a sunny breezy day it makes it nice to ride. In the essay the biker had no water left but was going down a hill. The going down the hill part was probably easy but the fact that he had no water left was not a good thing.	2	3	3
6687	3	The setting from the story left the cyclist in a mental way because most of the time the sun was on his mind due to the fact that he was pedaling hard in a hot summer day in June. The cyclist had very little water and with him biking under a beating sun wasn't exactly helping him. He  had to like disasterous events like, peddling slopes than the normal speed, a snake blocking the path, old men telling to take a different route then be infected, and the fact that his water supply was low made him think he was going to pass out under the burning sun. However his determination was strong as he continued on pedaling through and he eventually found himself in another town but this time with people, fish and water.	2	2	2
6688	3	From the setting that affected the cyclist are possible conditions such as the weather and surrounding enviorment like hills and streams or even tyes of animals and if they are poisenous or not. The setting has and can change the desision a cyclist makes.	1	1	1
6689	3	The features of the setting affect the cyclist in many ways. One way is that the hot sun makes the cyclist dehydrated and since there is no water sources around the cyclist is not getting any water. The rough terrain makes the cyclist tired.	1	1	1
6690	3	Many features of the carlifonian desert influenced the cyclist during his ride.Ghost towns, rolling hills, and dangerous snakes influenced the cyclists experience during the''shortcut'' to yosenite.The Ghost towns along the journey syndized the world desrting him during his ride by offering no help with water supply as a place to cool dowdn.The road sign warning of rough terrain was another barrier on his bike ride that he had to get through in dehydration to reach his goal,yosenite.The diamondback rattlesnate caused additional horror to the cyclist's'' ride from hell''.He had to manuever around the serpent while unstable from dehydration.All features of the cyclist's riding setting affected his ride to yosenite.	3	2	3
6691	3	The features of the setting affect the cyclist because if it's raining or snowing it affects the cyclist because pavement can be wet and icy. Which causes the cyclist to slip and @DATE1 and the cyclist can really get injured. Also the cyclist has to wear a helmet if it's very hot outside you wouldn't see the cyclist in winter clothes. This would make the cyclist unfocus and the cyclist wouldn't be able to finish any race.	1	1	1
6692	3	The features of the setting affect the cyclist because he can't go any farther because of the hills, and the snake. When he finds the bait shop he's relieved. He relieved because he can get something to drink. He can also buy the worms to eat. The cyclist didn't really know where he was going because there wasn't a car, building, or structure in sight. So the cyclist just keeps on riding until he comes across the bait shop or the first "town" as he calls it in the essay. When he comes across the road that has 55 mph per limit, and he's only 12 he knows that he's not going anywhere near Yosemite National Park.	2	2	2
6693	3	"The features of the setting in "Rough Road Ahead: Do Not Exceed Posted Speed Limit" affects the cyclist in many ways. First the setting does not look like what the cyclist has been told it lacks like. The cyclist had stopped to get directions from a group of older men who's directions were out of date. Second the conditions of the road affects the cyclist. In the essay the cyclist explains that, "Flat road was replaced by short, rolling hills." A final feature of the setting that affected the cyclist was the temperature. The hot sun beamed down on the cyclist. As you can see, the features of the setting in ""Rough Road Ahead: Do Not Exceed Posted Speed Limit"" affects the cyclist in many ways. "	2	2	2
6694	3	"The different settings in the essay/ writing affect the cyclist because of how old and hopeless they look. I think this because when the cyclist stops at the first town, he's looking around expecting to find a quaint, bustling little place, but instead he finds these abandoned, decimated old houses. And if you yourself can picture being in his situation, then you can imagine how discouraging and almost frightening that must be. As the cyclist continues for a few more miles, he's becoming slowly dehydrated, and finally sees a building. At first, he thinks this building is a mirage; he was wrong, but for him in this situation it was worse- an old juice factory, right when point you kind of get the feeling that every things turning against you and that there's no hope left. But when he finds the fishing camp, his entire perspective of things changes, and he just feels so thankful to have been saved."	3	3	3
6695	3	The setting affected the cyclist by the people from Lodi get him into the wrong way and he had to survive from there so he that was very dry and No water or nothing to the next stop was at the bait store so he was determined to get to next stop destination by he did want to give up own but the guy ask him did he want direction he said he was not going to be fooled twice.	1	1	1
6696	3	"It can't be known as, ""easy"" to ride through a desert on a bike. Adding rough pavement, rusty water pumps, and not so friendly animals adds to the discomfort as well. The cyclist in this story encountered all these things, making his supposedly pleasurable ride turn to a semi brutal experience "it got down on my hands and knee, working the handle of the rusted water pump with all my strength. Alike substance ooed out, followed by brackish water feeling somewhere in the neighborhood of two hundred degrees, "This quote shows how the conditions of his water supply where, which eventually lead him to dehydration. It lead: ROUGH ROAD AHEAD: DO NOT @CAPS1 SPEED LIMIT."This quote also shows how the riding conditions were making the  cyclist have a harder time keeping speed. "at some point tumberweeds crossed my path and a ridiculously large snake-it really did look like a diamond back-beaked the majority of the pavement in front of me." @CAPS2, this quote show of some of the dangers the  cyclist encountered. If  these features did not appear, then maybe the story would be describing a nice bike ride, but once you read about them, it becomes more of a disaster."	3	3	3
6697	3	The features of the setting affected the cyclist greatly. It was so hot where he was that he kept drinking his water without realizing it until he only had a couple of sips left. The terrain also made him thirsty because the more he had to go up and down hills, the more he would drink. The fact that he did not see any town except on ghost town for miles affected him because he did not think he was going to make it to the next town. The setting played a major role on the cyclist because it affected him that much.	2	2	2
6698	3	Setting plays a big role in this story. Without being in the desert in the hot @DATE1 there would not be a confict. There would be no importance in saving the water so he would not dehiderate. And the long flat roads are a symbol that the journey has still got a far way to go but as straight roads turn into hills it shows that there is a change in the journey and something better is about to happen.	2	2	2
6699	3	"The setting affect is used to a great extent in the short story "Do Not @CAPS1 Posted Speed Limit" The cycleist had beed going for a very long time when he came to the first town and there was no water At this point you can tell that he has lost confidence the "old timers"" directions. From this quote; "a ton-like substance oozed out." This quote shows how after @NUM1 miles of pedaling when he was supposed to have come to two towns by that point his one chance of water had been depleated. The next time the setting affect is used is when he comes for a building that was rusted out. He said, "I hung my head" this shows how he almost completely lost all hope and that he was sure that he is going to die."	3	3	3
6700	3	The cyclist is affected by @NUM1 couple different things. First, he is given directions that are out of date and then he has to deal with the heat of the weather in the early summer of California. If that wasn't enough, he then runs out of water, which he needs very badly. He runs into a couple more problems, like seeing a big snake and coming to a factory that used to make juice and it was now run down and empty. After all of these obsticles, the cyclist pulls through and makes it to @NUM1 fishing store, where he gets water.	2	2	2
6701	3	During the cyclist's biking adventure he encounters several interesting situations. Each experience is in response to the setting in which it takes place. For example, this young man starts out confident with a bright hope of eventually reaching Yosemite National Park. The first spot he comes to is a ghost town This sight doesn't immediately affect him, however it greatly adds on to the long term effects. He decides to continue on his treck reaching the next ghost from at this time he is becoming dehedrated due to his lack of water supply He decides to keep persueing his good and figures there must be water up ahead in the next town. In order to get the next town he must encounter some precarious situations including some changes in terrain. Eventually after reaching a source of running water he is overjoyed with happiness and relief. As evident in the provided text this man was effected by each feature of the setting. The different settings greatly affected his nature of confidence.	3	2	3
6702	3	The setting effects the rider because if it's hot you get thirsty and you have no water.This kind of question is hard to answer	1	1	1
6703	3	The features of the setting affected the cyclist by making the journey more dangerous and difficult. For example, in the reading it states that rediculously large, poisonous diamond back snakes. Blocked majority of the pavement. So, the cyclist had to keep his/her balance to ease past them. The terrian also changed into short, rolling hills, making it even more difficult. 	1	1	1
6704	3	The features in the setting of the essay affect the author in one major way, dehydration. There are several features that causes the author to dehydrate. First off, he is riding throught a desert located in california. This means that there is bent from the sun constintly beating down on him. Also the change from "Flat read", (Kurmaskie) to "short, rolling hills" (@CAPS1) also affected him, getting dehydrated. This change cased him to use more energy to climb up the hills which means he used more water because he got thrister faster. This is how the features in the setting affected the author of the essay "Rough Road Ahead: Do Not Exceed Posted Speed Limit."	2	2	2
6705	3	The features of the setting in "Do Not Exceed Posted Speed Limit" affect the cyclist. For example, the tough terrain made it very difficult for the cyclist to reach his destination, Yosemite. He was already very fatigued but had to overcome hills. In the essay, he states, "I noticed the terrain changing. Flat road was replaced by short, rolling hills. The setting features also affected the cyclist when he encountered the snake. He was dehydrated and could barely navigate around the dangerous snake. The cyclist explains, "At some point, tumbleweeds crossed my path and a riduculously large snake, it really did look like a diamondback-blocked the majority of the pavement in front of me. I eased fast, trying to keep my balance in my dehydrated state. The setting also affected the cyclist because there was no one around him to help. The cyclist describes, "There was no one in sight, not a building, car, or structure of any kind." The cyclist was all alone and had to rely on himself to make it to Yosemite. In conclusion, the features of the setting in "Do Not Exceed Posted Speed Limit" affect the cyclist. He had to overcome ruggid terrain without energy, avoid a diamondback snake, and make it all the way to Yosemite because there was no one around. As you can see, the features of the setting affect the cyclist.	3	3	3
6706	3	The features of the land around the cyclist caused him to confront  nature. when he began his trip with advice from "old coggers" he " rode out with strong legs and a smile." As he came to the first town, he describes it as a "ghost town" having no water and no human contact for some time. This should have been his cue to stop and turn around in hopes of another route to Yosemite. But with strong determination, he rods on. Through the miles he incountered a ramshackie shed, rusty pumps, snakes,and the wicked terrain. The short rolling hills tested his "inner spirit" and caused his dehydration to further. The land around the cyclist not only victimized his heath but also caused a poor way to spend a vacation.	2	2	2
6707	3	The harsh features at the setting affect the cyclist by hindering his journey to Yosemite National Park. As the cyclist is traveling along "The high deserts of California in June", some problems arise. The heat from the pounding sun in the desert takes a toll on the cyclist causing him to drink more water and rapidly deplet his supply. The cyclist is also traveling through small "gost towns" rather than stoping at appropriate rest stops in order to refill with water and relax etc. Also while refilling he encounters hazards such as "Short rolling hills" through ghost the terrain and ever a snake. All of these features in the setting impare the cyclists ability to maintain confidence in wether he will make it to his destination and his positive attitude toward the journey etc.	2	3	3
6708	3	Cycling is a very good sport people who do cycling are in shape. Also they have strong calve muscles. I think its also dangerous as well.	1	1	1
6709	3	In the story the author says, "The sun was beginning to beat down trying to keep my balance in my dehydrated state," This gives you the idea that the heat is getting to him and is steadily depleting his water supply. At ore point he almost gives him self up to despair and dies of dehydration. It seems that he will never reach his good and he will continue to suffer in the grueling heat. I could almost feel the sweat and heat that the cyclist was feeling. Also, I could almost feel the lump in my throat when he says, "with any luck I'd hit a bump and lodge a pebble in my throat." The heat definitely effects this mans cycling in a bad way. He was exhausted and could not go on without water.	2	2	2
6710	3	The cyclist thought it was hard. Also he was upset that the old timers gave bad directions.	2	2	2
6711	3	The setting affects the cyclist in many ways. First, he couldn't get water from anywhere because he was in a dessert with nothing but ramshackle sheds and rusty camps. Second, there were short rolling hills, and rough roads which made it hard to ride on. There were tumbleweeds in his way and large poisons snakes. The heat made it hard to keep riding. And there were no buildings structures of people around to give him a lift or water. That is how the setting affects the cyclist.	2	2	2
6712	3	In this essay by Joe Kurmaskie, a young man is baited into accepting outdated information by a group of old men. He pays for it later when on his bicycle, he is almost killed by heatstroke or dehydration. The setting is an excellent way to portray his feelings of hopelessness, despair, and fatigue. While he is just starting out, the road is flat and easy. It is cool and breezy. When he begins to run out of water, the terrain becomes bumpier and harder. He sees empty plains, cracked, dry ground, and the hot sun. He begins to despair even more. After a while when he thinks he can go no more he sees a store that once held gallons of grape juice. He laughs at the irony. The setting does do a wonderful job of describing his sense of helplessness.	3	3	3
6713	3	In this pasage the cyclist was affected by the setting because if it had been any were else he would not have suffered or learned at all. Because the seting had botha lack of civillesation and water that he needed that caused him to almost faint of thirst. This is an example of the setting affecting the cyclist, "With what I believed was my last burst of energy, I maneuvered down the hill." This showes that had all the setting been paridice he would never learned anything.	2	1	2
6714	3	The features of the setting in the essay caused the cyclist to suffer and continue being determined. The author of the essay used phrases such as ‘the sun was beating down" and "high deserts of California in June" to emphasize the extreme heat that caused the cyclist extreme thirst and heat exhaustion. The essay also says "short rolling hills", "tumbleweeds" and "long, crippling hill" to describe the difficult terrain the cyclist faced that caused him to be tired and slower.  Finally, the cyclist is faced with a "rediculously large snake" and plants and weeds which get in his way and force him to slow down.	2	2	2
6715	3	The setting effects the cyclist very much. By the very dry climates	2	2	2
6716	3	"The setting in the story ""Rough road ahead" plays a great role on the characters journey. Some features that are mentioned in the story are heat, rough road, long crippling hills and a abandoned Grape Juice Factory. The heat in the story drives the cyclist into a dying thirst. @CAPS1 does her best to conserve her water through out the trip but the dry dessert heat doesn't allow it. Then comes the rough road ahead. The cyclist trys to keep a steady and secure pass as @CAPS1 peddels along the bumps and breaks in the road. The long crippling hills are next in line the cyclist has to use all her energy to work up the hill. @CAPS1 wipes the sweat from her eyes to make sure its not a mirage and then @CAPS1 see's it the abandoned factory. This is where the cyclist loses all hope for if @CAPS1 doesn't receive water soon @CAPS1 is sure to be eaten by the birds. "Then, and easily as rounding a band, my troubles, thirst, and fear were all behind me. Gary and Wilber Fish Camp." @CAPS1 rushed to the bathroom to drink the refreshing water to the sink pride and accomplishment overwhelm her."	3	3	3
6717	3	"The features of the setting affect the cyclist because it gives him the feeling of hopelessness. When the cyclist got directions to Yosemite from these two ??? old people, he thought he was getting a good shortcut. In reality, he was just led on a road that seemed to head nowhere where he saw many things that added to his feeling of hopelessness, for example, the author writes, " I toiled on. At some points, tumbleweeds crossed my path and an adversely large snake. It really did move like a diamondback blocked the majority of the pavement in front of me."" This shows that the cyclist is getting tired and seeing tumbleweeds, which usually represents a phase being completely deserted and deadly snakes that get in his way. This answers the question because it shows how the setting leads to his feeling of hopelessness."	2	2	2
6718	3	The story "Do Not Exceed Posted Speed Limit" was a rough undergoing story about a cyclist going though rough climate and terrain. In this story the description was like a scorching path of nothingness for about as far for human eyes could see. In paragraph @NUM1 the text says "Wide rings of dried sweat circled my shirt, and the growing realization that I could die from heatstroke." is empressed how the climate felt. This explains the heat and how he felt during this experience. This whole trip sounds suffering.	1	1	1
